active,cik,composite_figi,currency_name,last_updated_utc,locale,market,name,primary_exchange,share_class_figi,ticker,type
True,0001100663,BBG01F749Y32,usd,2025-09-21T06:04:50.626949024Z,us,stocks,iShares J.P. Morgan Broad USD Emerging Markets Bond ETF,BATS,BBG01F749YY8,BEMB,ETF
True,0000038777,BBG000BD0TF8,usd,2025-09-21T06:04:50.626949244Z,us,stocks,"Franklin Resources, Inc.",XNYS,BBG001S5P3W6,BEN,CS
True,0001775734,BBG00KFV0B41,usd,2025-09-21T06:04:50.626949395Z,us,stocks,Beneficient Class A Common Stock,XNAS,BBG00KFV0B50,BENF,CS
True,0001775734,BBG01FVBG8K9,usd,2025-09-21T06:04:50.626949595Z,us,stocks,Beneficient Warrant,XNAS,,BENFW,WARRANT
True,,BBG01RXYQ4R2,usd,2025-09-21T06:04:50.626949825Z,us,stocks,Horizon Landmark ETF,ARCX,BBG01RXYQ6C3,BENJ,ETF
True,0001533232,,usd,2025-09-21T06:04:50.626949946Z,us,stocks,Brookfield Renewable Partners L.P.,XNYS,,BEP,CS
True,0001791863,BBG01RJ2V7B2,usd,2025-09-21T06:04:50.626950076Z,us,stocks,Brookfield Renewable Corporation Class A Exchangeable Subordinate Voting Shares,XNYS,BBG01RJ2Q8X2,BEPC,CS
True,0001533232,,usd,2025-09-21T06:04:50.626950196Z,us,stocks,Brookfield BRP Holdings (Canada) Inc. 4.625% Perpetual Subordinated Notes,XNYS,,BEPH,SP
True,0001533232,,usd,2025-09-21T06:04:50.626950306Z,us,stocks,Brookfield BRP Holdings (Canada) Inc. 4.875% Perpetual Subordinated Notes,XNYS,,BEPI,SP
True,0001533232,,usd,2025-09-21T06:04:50.626950467Z,us,stocks,Brookfield BRP Holdings (Canada) Inc. 7.250% Perpetual Subordinated Notes,XNYS,,BEPJ,SP
True,0001533232,,usd,2025-09-21T06:04:50.626950607Z,us,stocks,"Brookfield Renewable Partners L.P. 5.25% Class A Preferred Limited Partnership Units, Series 17",XNYS,,BEPpA,PFD
True,0000927971,BBG0123138B5,usd,2025-09-21T06:04:50.626950747Z,us,stocks,MicroSectors FANG & Innovation -3x Inverse Leveraged ETN,ARCX,BBG012313969,BERZ,ETN
True,,BBG01V8RP111,usd,2025-09-21T06:04:50.626950857Z,us,stocks,Bastion Energy ETF,BATS,BBG01V8RP246,BESF,ETF
True,,BBG01JLGN2B6,usd,2025-09-21T06:04:50.626951018Z,us,stocks,ProShares Bitcoin & Ether Equal Weight ETF,ARCX,BBG01JLGN351,BETE,ETF
True,,BBG01JLGNB44,usd,2025-09-21T06:04:50.626951138Z,us,stocks,ProShares Bitcoin & Ether Market Cap Weight ETF,ARCX,BBG01JLGNC06,BETH,ETF
True,0001835856,BBG0103VG6N0,usd,2025-09-21T06:04:50.626951268Z,us,stocks,Better Home & Finance Holding Company Class A Common Stock,XNAS,BBG0103VG6P8,BETR,CS
True,0001835856,BBG010B6T055,usd,2025-09-21T06:04:50.626951408Z,us,stocks,Better Home & Finance Holding Company Warrant,XNAS,,BETRW,WARRANT
True,0001776878,BBG00V7866V2,usd,2025-09-21T06:04:50.626951559Z,us,stocks,Roundhill Sports Betting & iGaming ETF,ARCX,BBG00V7867P7,BETZ,ETF
True,0000014693,BBG000BD2C18,usd,2025-09-21T06:04:50.626951699Z,us,stocks,Brown-Forman Corporation Class A,XNYS,BBG001S5P4G2,BF.A,CS
True,0000014693,BBG000BD2NY8,usd,2025-09-21T06:04:50.626951919Z,us,stocks,Brown-Forman Corporation Class B,XNYS,BBG001S5P4H1,BF.B,CS
True,0001437578,BBG003LFWP05,usd,2025-09-21T06:04:50.62695202Z,us,stocks,BRIGHT HORIZONS FAMILY SOLUTIONS INC.,XNYS,BBG003LFWPT4,BFAM,CS
True,0001329377,BBG01T3YN2T6,usd,2025-09-21T06:04:50.62695217Z,us,stocks,FT Vest Bitcoin Strategy Floor15 ETF - April,ARCX,BBG01T3YN3R6,BFAP,ETF
True,0001746109,BBG000BG27V9,usd,2025-09-21T06:04:50.62695228Z,us,stocks,Bank First Corporation Common Stock,XNAS,BBG001S79DP6,BFC,CS
True,0001482688,BBG00RHZ11C7,usd,2025-09-21T06:04:50.62695239Z,us,stocks,Innovator U.S. Equity Buffer ETF - February,BATS,BBG00RHZ1235,BFEB,ETF
True,0001101215,BBG000BFNR17,usd,2025-09-21T06:04:50.626952501Z,us,stocks,"Bread Financial Holdings, Inc.",XNYS,BBG001S78Z50,BFH,CS
True,0001303942,BBG000BCD4H9,usd,2025-09-21T06:04:50.626952691Z,us,stocks,BankFinancial Corporation,XNAS,BBG001S69N21,BFIN,CS
True,,BBG01462WN94,usd,2025-09-21T06:04:50.626952831Z,us,stocks,Build Bond Innovation ETF,ARCX,BBG01462WP99,BFIX,ETF
True,0001125816,BBG01VRRV3L7,usd,2025-09-21T06:04:50.626952961Z,us,stocks,FT Vest Bitcoin Strategy Floor15 ETF - July,ARCX,BBG01VRRV4Y1,BFJL,ETF
True,0001137393,BBG000BZGJ91,usd,2025-09-21T06:04:50.626953062Z,us,stocks,BlackRock Municipal Income Trust,XNYS,BBG001SFL2F9,BFK,FUND
True,0001804176,BBG00TN65975,usd,2025-09-21T06:04:50.626953202Z,us,stocks,"Butterfly Network, Inc.",XNYS,BBG00TN65984,BFLY,CS
True,0001804176,BBG00VXZJCF4,usd,2025-09-21T06:04:50.626953302Z,us,stocks,"Butterfly Network, Inc. Redeemable Warrants, each whole warrant exercisable for one share of Class A common stock, each at an exercise price of $11.50 per share",XNYS,,BFLY.WS,WARRANT
True,0001414040,BBG004N1S4Q6,usd,2025-09-21T06:04:50.626953532Z,us,stocks,Barron's 400 ETF,ARCX,BBG004N1S5G4,BFOR,ETF
True,,BBG01SX4YJH5,usd,2025-09-21T06:04:50.626953723Z,us,stocks,Westwood LBRTY Global Equity ETF,ARCX,BBG01SX4YKM6,BFRE,ETF
True,0001829247,BBG01BXY7SH6,usd,2025-09-21T06:04:50.626953883Z,us,stocks,"Bullfrog AI Holdings, Inc. Common Stock",XNAS,BBG01BXY7TD8,BFRG,CS
True,0001829247,BBG01CD99CS2,usd,2025-09-21T06:04:50.626954094Z,us,stocks,"Bullfrog AI Holdings, Inc. Warrants",XNAS,,BFRGW,WARRANT
True,0001858685,BBG00HTD0PX0,usd,2025-09-21T06:04:50.626954264Z,us,stocks,Biofrontera Inc. Common Stock,XNAS,BBG00HTD0PY9,BFRI,CS
True,0001858685,BBG013841CP0,usd,2025-09-21T06:04:50.626954484Z,us,stocks,Biofrontera Inc. Warrants,XNAS,,BFRIW,WARRANT
True,0001415726,BBG01TW7DK05,usd,2025-09-21T06:04:50.626954685Z,us,stocks,Innovator Equity Managed 100 Buffer ETF,ARCX,BBG01TW7DKV1,BFRZ,ETF
True,0000907254,BBG000BJ5G95,usd,2025-09-21T06:04:50.626954795Z,us,stocks,"Saul Centers, Inc.",XNYS,BBG001S7F7J9,BFS,CS
True,0001624322,BBG000TGZHS6,usd,2025-09-21T06:04:50.626955105Z,us,stocks,"Business First Bancshares, Inc. Common Stock",XNAS,BBG001T056Q8,BFST,CS
True,0000907254,,usd,2025-09-21T06:04:50.626955216Z,us,stocks,"Saul Centers, Inc. Depositary Shares, each representing 1/100th of a share of 6.125% Series D Cumulative Redeemable Preferred Stock",XNYS,,BFSpD,PFD
True,0000907254,,usd,2025-09-21T06:04:50.626955326Z,us,stocks,"Saul Centers, Inc. Depositary Shares, each representing 1/100th of a share of 6.000% Series E Cumulative Redeemable Preferred Stock",XNYS,,BFSpE,PFD
True,0001137391,BBG000BB9W75,usd,2025-09-21T06:04:50.626955406Z,us,stocks,BLACKROCK CA MUNICIPAL INC TR,XNYS,BBG001S5WLM9,BFZ,FUND
True,0001996862,,usd,2025-09-21T06:04:50.626955506Z,us,stocks,Bunge Global SA,XNYS,,BG,CS
True,0001546429,BBG002W5R785,usd,2025-09-21T06:04:50.626955586Z,us,stocks,Blackstone Strategic Credit 2027 Term Fund,XNYS,BBG002W5R801,BGB,FUND
True,0001094831,BBG01H9FTGX5,usd,2025-09-21T06:04:50.626955667Z,us,stocks,"BGC Group, Inc. Class A Common Stock",XNAS,BBG01H9FTHS9,BGC,CS
True,,BBG01R77QK76,usd,2025-09-21T06:04:50.626955747Z,us,stocks,Bahl & Gaynor Dividend ETF,ARCX,BBG01R77QL56,BGDV,ETF
True,0001156388,BBG000NF3BG5,usd,2025-09-21T06:04:50.626956117Z,us,stocks,Big 5 Sporting Goods Corp,XNAS,BBG001SD30D0,BGFV,CS
True,0001521404,BBG0034WH483,usd,2025-09-21T06:04:50.626956188Z,us,stocks,Barings Global Short Duration High Yield Fund,XNYS,BBG0034WH517,BGH,FUND
True,0001179821,BBG000BCPBN3,usd,2025-09-21T06:04:50.626956648Z,us,stocks,Birks Group Inc,XASE,BBG001S6PN78,BGI,CS
True,0001539639,BBG01J9TNBB2,usd,2025-09-21T06:04:50.626956769Z,us,stocks,Bahl & Gaynor Income Growth ETF,ARCX,BBG01J9TNC66,BGIG,ETF
True,0002019435,,usd,2025-09-21T06:04:50.626956849Z,us,stocks,Blue Gold Limited Class A Ordinary Shares,XNAS,,BGL,CS
True,0001737523,BBG00N70PLY0,usd,2025-09-21T06:04:50.626956929Z,us,stocks,BioNexus Gene Lab Corp Common stock,XNAS,BBG00N70PLZ9,BGLC,CS
True,0001329377,BBG00YXMR9N6,usd,2025-09-21T06:04:50.626957009Z,us,stocks,FT Vest Gold Strategy Quarterly Buffer ETF,BATS,BBG00YXMRBJ6,BGLD,ETF
True,0002019435,,usd,2025-09-21T06:04:50.626957089Z,us,stocks,Blue Gold Limited Warrant,XNAS,,BGLWW,WARRANT
True,0001779578,,usd,2025-09-21T06:04:50.626957169Z,us,stocks,BGM Group Ltd. Class A Ordinary Shares,XNAS,,BGM,CS
True,0001130166,BBG000CT3XM2,usd,2025-09-21T06:04:50.62695725Z,us,stocks,"Bio Green Med Solution, Inc. Common Stock",XNAS,BBG001SGNL18,BGMS,CS
True,0001130166,,usd,2025-09-21T06:04:50.62695733Z,us,stocks,"Bio Green Med Solution, Inc. 6% Convertible Preferred Stock",XNAS,,BGMSP,PFD
True,0001306550,BBG000QD1Q85,usd,2025-09-21T06:04:50.62695743Z,us,stocks,Blackrock Energy and Resources Trust,XNYS,BBG001SMMW12,BGR,FUND
True,0001100663,BBG00MK1NPJ5,usd,2025-09-21T06:04:50.62695751Z,us,stocks,iShares Trust iShares USD Green Bond ETF,XNAS,BBG00MK1NQ85,BGRN,ETF
True,0001761055,BBG01N4ZX8Z4,usd,2025-09-21T06:04:50.62695759Z,us,stocks,BlackRock ETF Trust iShares Large Cap Growth Active ETF,XNAS,BBG01N4ZX9W5,BGRO,ETF
True,0001278027,BBG000RKXRQ1,usd,2025-09-21T06:04:50.62695767Z,us,stocks,"B&G Foods, Inc.",XNYS,BBG001SQD861,BGS,CS
True,0001474903,BBG005DLS9N2,usd,2025-09-21T06:04:50.626957751Z,us,stocks,"BGSF, Inc.",XNYS,BBG005DLS9P0,BGSF,CS
True,0001287480,BBG000BWND57,usd,2025-09-21T06:04:50.626957831Z,us,stocks,BlackRock Floating Rate Income Trust,XNYS,BBG001SCPXR1,BGT,FUND
True,0001504234,BBG001855699,usd,2025-09-21T06:04:50.626957911Z,us,stocks,Blackstone Long-Short Credit Income Fund,XNYS,BBG001TCJG67,BGX,FUND
True,0001393299,BBG000QY41Y2,usd,2025-09-21T06:04:50.626957991Z,us,stocks,BlackRock Enhanced International Dividend Trust,XNYS,BBG001SSV2L3,BGY,FUND
True,0001726173,BBG00JPRDQH1,usd,2025-09-21T06:04:50.626958071Z,us,stocks,Biglari Holdings Inc. Class B Common Stock,XNYS,BBG00JPRDQJ9,BH,CS
True,0001726173,BBG00KK2W379,usd,2025-09-21T06:04:50.626958151Z,us,stocks,Biglari Holdings Inc. Class A Common Stock,XNYS,BBG00KK2W3Y9,BH.A,CS
True,0001759136,,usd,2025-09-21T06:04:50.626958231Z,us,stocks,Blue Hat Interactive Entertainment Technology Ordinary Shares,XNAS,,BHAT,CS
True,0000743367,BBG000JKM045,usd,2025-09-21T06:04:50.626958312Z,us,stocks,Bar Harbor Bankshares,XASE,BBG001SB8Q79,BHB,CS
True,0000885590,BBG000DLFM21,usd,2025-09-21T06:04:50.626958392Z,us,stocks,Bausch Health Companies Inc,XNYS,BBG001S7WDP0,BHC,CS
True,0000863436,BBG000C4JX31,usd,2025-09-21T06:04:50.626958632Z,us,stocks,Benchmark Electronics,XNYS,BBG001S6LXL4,BHE,CS
True,0001685040,BBG00DYPZ4T0,usd,2025-09-21T06:04:50.626958712Z,us,stocks,"Brighthouse Financial, Inc.",XNAS,BBG00DYPZ4V7,BHF,CS
True,0001685040,,usd,2025-09-21T06:04:50.626958803Z,us,stocks,"Brighthouse Financial, Inc. 6.25% Junior Subordinated Debentures due 2058",XNAS,,BHFAL,CS
True,0001685040,,usd,2025-09-21T06:04:50.626958903Z,us,stocks,"Brighthouse Financial, Inc. Depositary shares each representing a 1/1,000th Interest in a Share of 4.625% Non-Cumulative Preferred Stock, Series D",XNAS,,BHFAM,CS
True,0001685040,,usd,2025-09-21T06:04:50.626958983Z,us,stocks,"Brighthouse Financial, Inc. Depositary shares, each representing a 1/1,000th interest in a share of 5.375% Non-Cumulative Preferred Stock, Series C",XNAS,,BHFAN,CS
True,0001685040,,usd,2025-09-21T06:04:50.626959163Z,us,stocks,"Brighthouse Financial, Inc. Depositary Shares 6.75% Non-Cum Pfd Series B",XNAS,,BHFAO,CS
True,0001685040,,usd,2025-09-21T06:04:50.626959243Z,us,stocks,"Brighthouse Financial, Inc. Depositary Shares 6.6% Non-Cumulative Preferred Stock, Series A",XNAS,,BHFAP,PFD
True,0001160864,BBG000C09693,usd,2025-09-21T06:04:50.626959314Z,us,stocks,BLACKROCK CORE BD TR,XNYS,BBG001SFNB21,BHK,FUND
True,0001903382,BBG0146YWXC8,usd,2025-09-21T06:04:50.626959544Z,us,stocks,"Bluerock Homes Trust, Inc.",XASE,BBG0146YWXD7,BHM,CS
True,0000811809,BBG000BD5NZ4,usd,2025-09-21T06:04:50.626959624Z,us,stocks,BHP Group Limited American Depositary Shares (Each representing two Ordinary Shares),XNYS,BBG001S5P5K4,BHP,ADRC
True,0001574085,BBG004PW84G9,usd,2025-09-21T06:04:50.626959744Z,us,stocks,Braemar Hotels & Resorts Inc. Common Stock,XNYS,BBG004PW8567,BHR,CS
True,0001964333,BBG019X33P07,usd,2025-09-21T06:04:50.626959855Z,us,stocks,Burke & Herbert Financial Services Corp. Common Stock,XNAS,BBG019X33P61,BHRB,CS
True,0001574085,,usd,2025-09-21T06:04:50.626959945Z,us,stocks,Braemar Hotels & Resorts Inc. 5.50% Series B Cumulative Convertible Preferred Stock,XNYS,,BHRpB,PFD
True,0001574085,,usd,2025-09-21T06:04:50.626960025Z,us,stocks,"Braemar Hotels & Resorts Inc. 8.25% Series D Cumulative Preferred Stock, par value $0.01 per share",XNYS,,BHRpD,PFD
True,0001723464,BBG00NB02NZ5,usd,2025-09-21T06:04:50.626960105Z,us,stocks,BioHarvest Sciences Inc. Common Stock,XNAS,BBG0086KQ0S2,BHST,CS
True,0001169034,BBG000DXJJH2,usd,2025-09-21T06:04:50.626960175Z,us,stocks,BlackRock Virginia Muni Bond Trust,XNYS,BBG001SKCDT9,BHV,FUND
True,0001935979,,usd,2025-09-21T06:04:50.626960255Z,us,stocks,Biohaven Ltd.,XNYS,,BHVN,CS
True,,BBG01JTRL253,usd,2025-09-21T06:04:50.626960335Z,us,stocks,Xtrackers USD High Yield BB-B ex Financials ETF,BATS,BBG01JTRLM68,BHYB,ETF
True,0001712762,BBG00H69JDX1,usd,2025-09-21T06:04:50.626960416Z,us,stocks,"bioAffinity Technologies, Inc. Common Stock",XNAS,BBG00H69JDY0,BIAF,CS
True,0001712762,BBG018DZJPN8,usd,2025-09-21T06:04:50.626960496Z,us,stocks,"bioAffinity Technologies, Inc. Warrant",XNAS,,BIAFW,WARRANT
True,0001174610,BBG000QMBZX6,usd,2025-09-21T06:04:50.626960576Z,us,stocks,ProShares Ultra NASDAQ Biotechnology,XNAS,BBG001T7V4Q9,BIB,ETF
True,0001733356,BBG00J3H9QW5,usd,2025-09-21T06:04:50.626960666Z,us,stocks,Inspire 100 ETF,ARCX,BBG00J3H9RL5,BIBL,ETF
True,0001761055,BBG01QVVCQY0,usd,2025-09-21T06:04:50.626960746Z,us,stocks,iShares International Dividend Active ETF,ARCX,BBG01QVVCRV1,BIDD,ETF
True,0001329099,BBG000QXWHD1,usd,2025-09-21T06:04:50.626960826Z,us,stocks,"Baidu, Inc.",XNAS,BBG001SNBKD5,BIDU,ADRC
True,,BBG01QRKG3V9,usd,2025-09-21T06:04:50.626961097Z,us,stocks,YieldMax Target 12 Big 50 Option Income ETF,ARCX,BBG01QRKG4Q3,BIGY,ETF
True,0000875045,BBG000C17X76,usd,2025-09-21T06:04:50.626961177Z,us,stocks,Biogen Inc. Common Stock,XNAS,BBG001S67826,BIIB,CS
True,0001081019,BBG000RFQSH8,usd,2025-09-21T06:04:50.626961277Z,us,stocks,SPDR Bloomberg 1-3 Month T-Bill ETF,ARCX,BBG001STKCW9,BIL,ETF
True,0001969995,BBG01KBR85T1,usd,2025-09-21T06:04:50.626961357Z,us,stocks,Macquarie Global Listed Infrastructure ETF,ARCX,BBG01KBR86N5,BILD,ETF
True,0001723690,BBG00K7T3037,usd,2025-09-21T06:04:50.626961438Z,us,stocks,Bilibili Inc. American Depositary Shares,XNAS,BBG00K7T30T9,BILI,ADRC
True,0001786352,BBG00QVJV6V4,usd,2025-09-21T06:04:50.626961518Z,us,stocks,"BILL Holdings, Inc.",XNYS,BBG00QVJV7L3,BILL,CS
True,0001081019,BBG00X8RXFQ1,usd,2025-09-21T06:04:50.626961598Z,us,stocks,SPDR Bloomberg 3-12 Month T-Bill ETF,ARCX,BBG00X8RXGK5,BILS,ETF
True,0001761055,BBG01W9TSW68,usd,2025-09-21T06:04:50.626961678Z,us,stocks,iShares Infrastructure Active ETF,BATS,BBG01W9TSX57,BILT,ETF
True,0001450011,BBG01GZF4L55,usd,2025-09-21T06:04:50.626961758Z,us,stocks,PIMCO Ultra Short Government Active ETF,ARCX,BBG01GZF4M26,BILZ,ETF
True,0001804196,BBG01GQYLJ23,usd,2025-09-21T06:04:50.626961848Z,us,stocks,iShares Flexible Income Active ETF,ARCX,BBG01GQYLJY8,BINC,ETF
True,0001499961,BBG003GMH2G7,usd,2025-09-21T06:04:50.626961928Z,us,stocks,"Bollinger Innovations, Inc. Common Stock",XNAS,BBG003GMH366,BINI,CS
True,0001452937,BBG01VD0TS93,usd,2025-09-21T06:04:50.626962009Z,us,stocks,Bluemonte Global Equity ETF,ARCX,BBG01VD0TTS0,BINT,ETF
True,0001616265,BBG01JM52LJ2,usd,2025-09-21T06:04:50.626962089Z,us,stocks,Brandes International ETF,BATS,BBG01JM52MM6,BINV,ETF
True,0000012208,BBG000DY28W5,usd,2025-09-21T06:04:50.626962169Z,us,stocks,"Bio-Rad Laboratories, Inc.Class A",XNYS,BBG001S625W4,BIO,CS
True,0000012208,BBG000BD6WM7,usd,2025-09-21T06:04:50.626962249Z,us,stocks,"Bio-Rad Laboratories, Inc. Class B",XNYS,BBG001S5P622,BIO.B,CS
True,0001709941,BBG00HBTB0M9,usd,2025-09-21T06:04:50.626962329Z,us,stocks,"BioAge Labs, Inc. Common Stock",XNAS,BBG00HBTB0N8,BIOA,CS
True,0001769484,,usd,2025-09-21T06:04:50.626962409Z,us,stocks,Bioceres Crop Solutions Corp. Ordinary Shares,XNAS,,BIOX,CS
True,0001406234,,usd,2025-09-21T06:04:50.62696252Z,us,stocks,Brookfield Infrastructure Partners L.P. Limited Partnership Units,XNYS,,BIP,CS
True,0001788348,BBG01RJ2W204,usd,2025-09-21T06:04:50.62696263Z,us,stocks,Brookfield Infrastructure Corporation Class A Exchangeable Subordinate Voting Shares,XNYS,BBG01RJ2TXY3,BIPC,CS
True,0001406234,,usd,2025-09-21T06:04:50.62696271Z,us,stocks,Brookfield Infrastructure Finance ULC 5.000% Subordinated Notes due 2081,XNYS,,BIPH,SP
True,0001406234,,usd,2025-09-21T06:04:50.62696279Z,us,stocks,BIP Bermuda Holdings I Limited 5.125% Perpetual Subordinated Notes,XNYS,,BIPI,SP
True,0001406234,,usd,2025-09-21T06:04:50.62696287Z,us,stocks,Brookfield Infrastructure Finance ULC 7.250% Subordinated Notes due 2084,XNYS,,BIPJ,SP
True,0001406234,,usd,2025-09-21T06:04:50.62696295Z,us,stocks,"Brookfield Infrastructure Partners L.P. 5.125% Class A Preferred Limited Partnership Units, Series 13",XNYS,,BIPpA,PFD
True,0001406234,,usd,2025-09-21T06:04:50.626963031Z,us,stocks,"Brookfield Infrastructure Partners L.P. 5.000% Class A Preferred Limited Partnership Units, Series 14",XNYS,,BIPpB,PFD
True,0001653909,BBG00CCNTK76,usd,2025-09-21T06:04:50.626963111Z,us,stocks,"Allbirds, Inc. Class A Common Stock",XNAS,BBG00CCNTK94,BIRD,CS
True,0001977102,,usd,2025-09-21T06:04:50.626963191Z,us,stocks,Birkenstock Holding plc,XNYS,,BIRK,CS
True,0001174610,BBG000QMCF87,usd,2025-09-21T06:04:50.626963271Z,us,stocks,ProShares UltraShort NASDAQ Biotechnology,XNAS,BBG001T7V4S7,BIS,ETF
True,0001562818,BBG003P84BH1,usd,2025-09-21T06:04:50.626963381Z,us,stocks,BLACKROCK MULTI-SECTOR INCOME TRUST,XNYS,BBG003P84C70,BIT,FUND
True,0001763415,BBG01KY66LW5,usd,2025-09-21T06:04:50.626963461Z,us,stocks,Bitwise Bitcoin ETF,ARCX,BBG01KY66MQ0,BITB,ETV
True,,BBG01FZQP5S0,usd,2025-09-21T06:04:50.626963542Z,us,stocks,Bitwise Trendwise Bitcoin and Treasuries Rotation Strategy ETF,ARCX,BBG01FZQP6S8,BITC,ETF
True,0001812477,BBG00PZTS4J3,usd,2025-09-21T06:04:50.626963622Z,us,stocks,Bitfarms Ltd. Common Stock,XNAS,BBG00PGMZVM7,BITF,CS
True,0001174610,BBG018C3QG43,usd,2025-09-21T06:04:50.626963702Z,us,stocks,ProShares Short Bitcoin ETF,ARCX,BBG018C3QH78,BITI,ETF
True,0001174610,BBG0131STJL3,usd,2025-09-21T06:04:50.626963782Z,us,stocks,ProShares Bitcoin ETF,ARCX,BBG0131STKH5,BITO,ETF
True,0001452937,BBG01076JF30,usd,2025-09-21T06:04:50.626963862Z,us,stocks,Bitwise Crypto Industry Innovators ETF,ARCX,BBG01076JFY6,BITQ,ETF
True,,BBG013J592N1,usd,2025-09-21T06:04:50.626963942Z,us,stocks,Global X Blockchain & Bitcoin Strategy ETF,XNAS,BBG013J593K2,BITS,ETF
True,,BBG01M79Z7R0,usd,2025-09-21T06:04:50.626964033Z,us,stocks,ProShares Ultra Bitcoin ETF,ARCX,BBG01M79Z8W2,BITU,ETF
True,,BBG01GXLYLP9,usd,2025-09-21T06:04:50.626964113Z,us,stocks,2x Bitcoin Strategy ETF,BATS,BBG01GXLYNB0,BITX,ETF
True,0001633061,BBG01THXH1S3,usd,2025-09-21T06:04:50.626964203Z,us,stocks,Amplify Bitcoin 2% Monthly Option Income ETF,BATS,BBG01THXH2N6,BITY,ETF
True,0000794105,BBG000R44SW0,usd,2025-09-21T06:04:50.626964493Z,us,stocks,Vanguard Intermediate-Term Bond ETF,ARCX,BBG001ST39R1,BIV,ETF
True,0001580149,BBG00548BTD6,usd,2025-09-21T06:04:50.626964574Z,us,stocks,"BioVie, Inc. Common Stock",XNAS,BBG00548BTF4,BIVI,CS
True,0001580149,BBG01WJZNKD6,usd,2025-09-21T06:04:50.626964654Z,us,stocks,BioVie Inc. Warrant,XNAS,,BIVIW,WARRANT
True,0001944712,,usd,2025-09-21T06:04:50.626964734Z,us,stocks,Baiya International Group Inc. Ordinary Shares,XNAS,,BIYA,CS
True,0001137360,BBG00440GKJ4,usd,2025-09-21T06:04:50.626964814Z,us,stocks,VanEck BDC Income ETF,ARCX,BBG00440GL84,BIZD,ETF
True,0001531152,BBG00FQ8T4G3,usd,2025-09-21T06:04:50.626964894Z,us,stocks,"BJs Wholesale Club Holdings, Inc. Common Stock",XNYS,BBG00FQ8T4M6,BJ,CS
True,0001482688,BBG00MYXK749,usd,2025-09-21T06:04:50.626964974Z,us,stocks,Innovator U.S. Equity Buffer ETF - January,BATS,BBG00MYXK7W8,BJAN,ETF
True,0001704287,BBG012TKJCJ1,usd,2025-09-21T06:04:50.626965054Z,us,stocks,"Bluejay Diagnostics, Inc. Common Stock",XNAS,BBG012TKJDC6,BJDX,CS
True,0001137360,BBG000V86Z03,usd,2025-09-21T06:04:50.626965275Z,us,stocks,VanEck Gaming ETF,XNAS,BBG001T1Q9C2,BJK,ETF
True,0001013488,BBG000H9LNX1,usd,2025-09-21T06:04:50.626965355Z,us,stocks,"BJ's Restaurants, Inc.",XNAS,BBG001S970P2,BJRI,CS
True,0001482688,BBG00LNJLC51,usd,2025-09-21T06:04:50.626965565Z,us,stocks,Innovator U.S. Equity Buffer ETF - July,BATS,BBG00LNJLCX0,BJUL,ETF
True,0001415726,BBG00PBD5ZW5,usd,2025-09-21T06:04:50.626965646Z,us,stocks,Innovator U.S. Equity Buffer ETF - June,BATS,BBG00PBD60M2,BJUN,ETF
True,0001390777,BBG000BD8PN9,usd,2025-09-21T06:04:50.626965726Z,us,stocks,Bank of New York Mellon Corporation,XNYS,BBG001S5P6Q6,BK,CS
True,,BBG00RYR56Q6,usd,2025-09-21T06:04:50.626965806Z,us,stocks,BNY Mellon Core Bond ETF,ARCX,BBG00RYR57H4,BKAG,ETF
True,,BBG01SXJKVN3,usd,2025-09-21T06:04:50.626965886Z,us,stocks,BNY Mellon Concentrated Growth ETF,ARCX,BBG01SXJKWT5,BKCG,ETF
True,0001432353,BBG011RVGZP6,usd,2025-09-21T06:04:50.626965976Z,us,stocks,Global X Blockchain ETF,XNAS,BBG011RVH0K7,BKCH,ETF
True,,BBG013VPCK31,usd,2025-09-21T06:04:50.626966046Z,us,stocks,BNY Mellon Concentrated International ETF,ARCX,BBG013VPCL11,BKCI,ETF
True,0001332349,BBG000J4L211,usd,2025-09-21T06:04:50.626966137Z,us,stocks,"Brookdale Senior Living, Inc.",XNYS,BBG001SDHC58,BKD,CS
True,,BBG01QM8ZCH6,usd,2025-09-21T06:04:50.626966217Z,us,stocks,BNY Mellon Dynamic Value ETF,ARCX,BBG01QM8ZDG5,BKDV,ETF
True,0000885245,BBG000BD9525,usd,2025-09-21T06:04:50.626966297Z,us,stocks,"The Buckle, Inc.",XNYS,BBG001S5P6T3,BKE,CS
True,,BBG00RYRC6L3,usd,2025-09-21T06:04:50.626966377Z,us,stocks,BNY Mellon Emerging Markets Equity ETF,ARCX,BBG00RYRC7B2,BKEM,ETF
True,0000930667,BBG000TVZ652,usd,2025-09-21T06:04:50.626966457Z,us,stocks,iShares MSCI BIC ETF,ARCX,BBG001T0LKN2,BKF,ETF
True,,BBG01B7B20H1,usd,2025-09-21T06:04:50.626966537Z,us,stocks,BNY Mellon Global Infrastructure Income ETF,BATS,BBG01B7B21C4,BKGI,ETF
True,0001130464,BBG000BD9ZM7,usd,2025-09-21T06:04:50.626966617Z,us,stocks,Black Hills Corporation,XNYS,BBG001S5P6X8,BKH,CS
True,0002000775,,usd,2025-09-21T06:04:50.626966698Z,us,stocks,Black Hawk Acquisition Corporation Class A Ordinary Shares,XNAS,,BKHA,CS
True,0002000775,,usd,2025-09-21T06:04:50.626966778Z,us,stocks,Black Hawk Acquisition Corporation Rights,XNAS,,BKHAR,RIGHT
True,0002000775,,usd,2025-09-21T06:04:50.626966858Z,us,stocks,Black Hawk Acquisition Corporation Units,XNAS,,BKHAU,UNIT
True,,BBG00RYR5TG7,usd,2025-09-21T06:04:50.626966938Z,us,stocks,BNY Mellon High Yield ETF,ARCX,BBG00RYR5V63,BKHY,ETF
True,,BBG00RYRB9H3,usd,2025-09-21T06:04:50.626967018Z,us,stocks,BNY Mellon International Equity ETF,ARCX,BBG00RYRBB79,BKIE,ETF
True,0001820302,BBG00XRJ7Y40,usd,2025-09-21T06:04:50.626967098Z,us,stocks,"Bakkt Holdings, Inc.",XNYS,BBG00XRJ7Y59,BKKT,CS
True,0001820302,BBG00Y624BK3,usd,2025-09-21T06:04:50.626967179Z,us,stocks,"Bakkt Holdings, Inc Warrants to purchase Class A Common Stock Each Warrant entitles to purchase 1/25th of a share of Class A common stock at an exercise price of $287.50 for one share of Class A Common Stock",XNYS,,BKKT.WS,WARRANT
True,,BBG00RYR67P4,usd,2025-09-21T06:04:50.626967269Z,us,stocks,BNY Mellon US Large Cap Core Equity ETF,ARCX,BBG00RYR68F3,BKLC,ETF
True,0000914208,BBG001K94N28,usd,2025-09-21T06:04:50.626967349Z,us,stocks,Invesco Senior Loan ETF,ARCX,BBG001V0MBC0,BKLN,ETF
True,,BBG00RYR6CV6,usd,2025-09-21T06:04:50.626967429Z,us,stocks,BNY Mellon US Mid Cap Core Equity ETF,ARCX,BBG00RYR6DL5,BKMC,ETF
True,0000894242,BBG000BG98N9,usd,2025-09-21T06:04:50.626967509Z,us,stocks,BlackRock Investment Quality Municipal Trust,XNYS,BBG001S72D73,BKN,FUND
True,0001075531,BBG000BLBVN4,usd,2025-09-21T06:04:50.626967589Z,us,stocks,Booking Holdings Inc. Common Stock,XNAS,BBG001S89N72,BKNG,CS
True,,BBG01WX1TM09,usd,2025-09-21T06:04:50.626967669Z,us,stocks,T-REX 2X Long BKNG Daily Target ETF,BATS,BBG01WX1TMZ1,BKNU,ETF
True,0001701605,BBG00GBVBK51,usd,2025-09-21T06:04:50.62696775Z,us,stocks,Baker Hughes Company,XNAS,BBG00GBVBK60,BKR,CS
True,,BBG00RYR6KV8,usd,2025-09-21T06:04:50.62696783Z,us,stocks,BNY Mellon US Small Cap Core Equity ETF,ARCX,BBG00RYR6LL7,BKSE,ETF
True,0001753539,BBG00QRY6P33,usd,2025-09-21T06:04:50.62696791Z,us,stocks,BlackSky Technology Inc.,XNYS,BBG00QRY6P42,BKSY,CS
True,0001753539,BBG00R2NP1J7,usd,2025-09-21T06:04:50.62696799Z,us,stocks,"BlackSky Technology Inc. Redeemable Warrants, each whole Warrant exercisable for one-eighth (1/8th) of a share of Class A Common Stock at an exercise price of $92.00 per whole share",XNYS,,BKSY.WS,WARRANT
True,0000832327,BBG000BDC193,usd,2025-09-21T06:04:50.62696807Z,us,stocks,BlackRock Income Trust Inc.,XNYS,BBG001S5P7B0,BKT,FUND
True,0000002186,BBG00NKSM4N7,usd,2025-09-21T06:04:50.626968261Z,us,stocks,BK Technologies Corporation,XASE,BBG00NKSM4P5,BKTI,CS
True,0001504008,BBG000PQPCM6,usd,2025-09-21T06:04:50.626968341Z,us,stocks,"Bankunited, Inc.",XNYS,BBG001T5W6B3,BKU,CS
True,,BBG0122M5L01,usd,2025-09-21T06:04:50.626968441Z,us,stocks,BNY Mellon Ultra Short Income ETF,ARCX,BBG0122M5LV7,BKUI,ETF
True,0001838406,BBG00YNGK485,usd,2025-09-21T06:04:50.626968521Z,us,stocks,BKV Corporation,XNYS,BBG00YNGK494,BKV,CS
True,0001019034,BBG000BHHR29,usd,2025-09-21T06:04:50.626968601Z,us,stocks,"BIO-key International, Inc. Common Stock",XNAS,BBG001S7ZTY2,BKYI,CS
True,0001390777,,usd,2025-09-21T06:04:50.626968681Z,us,stocks,"The Bank of New York Mellon Corporation Depositary Shares, each representing a 1/4,000th interest in a share of Series K Noncumulative Perpetual Preferred Stock",XNYS,,BKpK,PFD
True,0001666134,BBG0029KJVB0,usd,2025-09-21T06:04:50.626968762Z,us,stocks,"BlackLine, Inc. Common Stock",XNAS,BBG0029KJVD8,BL,CS
True,0001589526,BBG006427SW3,usd,2025-09-21T06:04:50.626968842Z,us,stocks,Blue Bird Corporation Common Stock,XNAS,BBG006427TN1,BLBD,CS
True,0001567900,BBG007GGHNQ4,usd,2025-09-21T06:04:50.626968922Z,us,stocks,Blackboxstocks Inc. Common Stock,XNAS,BBG007GGHNR3,BLBX,CS
