active,cik,composite_figi,currency_name,last_updated_utc,locale,market,name,primary_exchange,share_class_figi,ticker,type
True,0001898391,BBG01VBP2H66,usd,2025-09-21T06:04:50.627195965Z,us,stocks,Fidelity Managed Futures ETF,XNAS,BBG01VBP2J35,FFUT,ETF
True,0001413837,BBG001V9VY04,usd,2025-09-21T06:04:50.627196045Z,us,stocks,First Foundation Inc.,XNYS,BBG001V9VY13,FFWM,CS
True,0001934850,BBG01BGVGG87,usd,2025-09-21T06:04:50.627196135Z,us,stocks,"F&G Annuities & Life, Inc.",XNYS,BBG01BGVGH85,FG,CS
True,0001408534,BBG000BRLPF2,usd,2025-09-21T06:04:50.627196215Z,us,stocks,FIRST GUARANTY BANCSHARES INC,XNAS,BBG001SCGLY9,FGBI,CS
True,0001408534,,usd,2025-09-21T06:04:50.627196296Z,us,stocks,"First Guaranty Bancshares, Inc. 6.75% Series A Fixed-Rate Non-Cumulative Perpetual Preferred Stock",XNAS,,FGBIP,PFD
True,0001364608,BBG000TYHFH3,usd,2025-09-21T06:04:50.627196376Z,us,stocks,First Trust Dow Jones Global Select Dividend Index Fund,ARCX,BBG001T0S727,FGD,ETF
True,0001858258,BBG018KX3Q23,usd,2025-09-21T06:04:50.627196456Z,us,stocks,Franklin Responsibly Sourced Gold ETF,ARCX,BBG018KX3R21,FGDL,ETV
True,0000921299,BBG000FW5ZL6,usd,2025-09-21T06:04:50.627196536Z,us,stocks,"FibroGen, Inc",XNAS,BBG001SN7DS0,FGEN,CS
True,0001864943,,usd,2025-09-21T06:04:50.627196616Z,us,stocks,FGI Industries Ltd. Ordinary Shares,XNAS,,FGI,CS
True,0001864943,,usd,2025-09-21T06:04:50.627196696Z,us,stocks,FGI Industries Ltd. Warrant,XNAS,,FGIWW,WARRANT
True,0001989930,,usd,2025-09-21T06:04:50.627196776Z,us,stocks,Founder Group Limited Class A Ordinary Shares,XNAS,,FGL,CS
True,0001510337,BBG002N8WN24,usd,2025-09-21T06:04:50.627196857Z,us,stocks,First Trust Germany AlphaDEX Fund,XNAS,BBG002N8WNT5,FGM,ETF
True,0001906364,BBG01R78HB10,usd,2025-09-21T06:04:50.627196937Z,us,stocks,FG Merger II Corp. Common stock,XNAS,BBG01R78HC09,FGMC,CS
True,0001906364,BBG01S6Z71F7,usd,2025-09-21T06:04:50.627197137Z,us,stocks,FG Merger II Corp. Rights,XNAS,BBG01S6Z72D7,FGMCR,RIGHT
True,0001906364,BBG01JX8BW55,usd,2025-09-21T06:04:50.627197227Z,us,stocks,FG Merger II Corp. Unit,XNAS,BBG01JX8BW64,FGMCU,UNIT
True,0001934850,,usd,2025-09-21T06:04:50.627197348Z,us,stocks,"F&G Annuities & Life, Inc. 7.950% Senior Notes due 2053",XNYS,,FGN,SP
True,0001591890,BBG01BY3XPZ0,usd,2025-09-21T06:04:50.627197428Z,us,stocks,FG Nexus Inc. Common Stock,XNAS,BBG01BY3XQ06,FGNX,CS
True,0001591890,,usd,2025-09-21T06:04:50.627197518Z,us,stocks,FG Nexus Inc. 8.00% Cumulative Preferred Stock,XNAS,,FGNXP,PFD
True,0001517936,BBG01VR0JJ35,usd,2025-09-21T06:04:50.627197598Z,us,stocks,FT Vest Growth Strength & Target Income ETF,XNAS,BBG01VR0JK14,FGSI,ETF
True,,BBG01RB8T7B0,usd,2025-09-21T06:04:50.627197678Z,us,stocks,Frontier Asset Global Small Cap Equity ETF,ARCX,BBG01RB8T873,FGSM,ETF
True,0001934850,,usd,2025-09-21T06:04:50.627197758Z,us,stocks,"F&G Annuities & Life, Inc. 7.300% Junior Subordinated Notes due 2065",XNYS,,FGSN,SP
True,0000036377,BBG0046LJYT2,usd,2025-09-21T06:04:50.627197838Z,us,stocks,"First Hawaiian, Inc. Common Stock",XNAS,BBG0046LJYX7,FHB,CS
True,0001667919,BBG01QQXJ303,usd,2025-09-21T06:04:50.627197919Z,us,stocks,FT Vest U.S. Equity Quarterly Dynamic Buffer ETF,BATS,BBG01QQXJ3V9,FHDG,ETF
True,0001898391,BBG01M5HQNM4,usd,2025-09-21T06:04:50.627197999Z,us,stocks,Fidelity Hedged Equity ETF,BATS,BBG01M5HQQ01,FHEQ,ETF
True,0001056288,BBG000BP0929,usd,2025-09-21T06:04:50.627198079Z,us,stocks,"Federated Hermes, Inc.",XNYS,BBG001S6TGK4,FHI,CS
True,0000945908,BBG005FHVV47,usd,2025-09-21T06:04:50.627198169Z,us,stocks,Fidelity MSCI Health Care Index ETF,ARCX,BBG005FHVV56,FHLC,ETF
True,0000036966,BBG000GHZSZ6,usd,2025-09-21T06:04:50.627198249Z,us,stocks,First Horizon Corporation,XNYS,BBG001SCW8R8,FHN,CS
True,0000036966,,usd,2025-09-21T06:04:50.627198339Z,us,stocks,"First Horizon Corporation Depositary Shares, each representing a 1/400th interest in a share of Non-Cumulative Perpetual Preferred Stock, Series C",XNYS,,FHNpC,PFD
True,0000036966,,usd,2025-09-21T06:04:50.62719842Z,us,stocks,"First Horizon Corporation Depositary Shares, Each Representing a 1/ 4000th Interest in a Share of Non-cumulative Perpetual Series E Preferred Stock",XNYS,,FHNpE,PFD
True,0000036966,,usd,2025-09-21T06:04:50.6271985Z,us,stocks,"First Horizon Corporation Depositary Shares, each representing 1/4000th Interest in a Share of Non-Cumulative Perpetual Preferred Stock, Series F",XNYS,,FHNpF,PFD
True,0001822462,BBG00HFZPB88,usd,2025-09-21T06:04:50.62719858Z,us,stocks,Foghorn Therapeutics Inc. Common Stock,XNAS,BBG00HFZPB97,FHTX,CS
True,0001849998,BBG013BTDBC4,usd,2025-09-21T06:04:50.62719866Z,us,stocks,Federated Hermes Short Duration High Yield ETF,ARCX,BBG013BTDC87,FHYS,ETF
True,0000798354,BBG000BJKPG0,usd,2025-09-21T06:04:50.62719874Z,us,stocks,"Fiserv, Inc.",XNYS,BBG001S5R6Q4,FI,CS
True,0001924868,BBG01NP80C42,usd,2025-09-21T06:04:50.62719882Z,us,stocks,YieldMax Short COIN Option Income Strategy ETF,ARCX,BBG01NP80D31,FIAT,ETS
True,,BBG01BTRTQK2,usd,2025-09-21T06:04:50.627198901Z,us,stocks,Nicholas Fixed Income Alternative ETF,ARCX,BBG01BTRTRF6,FIAX,ETF
True,0000860413,BBG000BMSC38,usd,2025-09-21T06:04:50.627199011Z,us,stocks,"First Interstate BancSystem, Inc. Common Stock (DE)",XNAS,BBG001S9F1B6,FIBK,CS
True,0000814547,BBG000DW76Y6,usd,2025-09-21T06:04:50.627199091Z,us,stocks,Fair Isaac Corporation,XNYS,BBG001S8ZT61,FICO,CS
True,0001552740,BBG00YGCBLZ4,usd,2025-09-21T06:04:50.627199171Z,us,stocks,First Trust International Developed Capital Strength ETF,XNAS,BBG00YGCBMV6,FICS,ETF
True,0001552740,BBG0055FL7F4,usd,2025-09-21T06:04:50.627199251Z,us,stocks,First Trust Exchange-Traded Fund VI First Trust S&P International Dividend Aristocrats ETF,XNAS,BBG0055FL7G3,FID,ETF
True,0000945908,BBG00JRH22Y7,usd,2025-09-21T06:04:50.627199331Z,us,stocks,Fidelity International High Dividend ETF,ARCX,BBG00JRH23N7,FIDI,ETF
True,0000945908,BBG005FHVVY4,usd,2025-09-21T06:04:50.627199411Z,us,stocks,Fidelity MSCI Industrials Index ETF,ARCX,BBG005FHVVZ3,FIDU,ETF
True,0001467761,BBG000LDSKW7,usd,2025-09-21T06:04:50.627199492Z,us,stocks,"FiEE, Inc Common Stock",XNAS,BBG001T495P9,FIEE,CS
True,0001579878,BBG00BLZ2CD1,usd,2025-09-21T06:04:50.627199572Z,us,stocks,"Figma, Inc.",XNYS,BBG00BLZ2CF9,FIG,CS
True,0001562565,BBG00ZGX8833,usd,2025-09-21T06:04:50.627199642Z,us,stocks,Fidelity Investment Grade Bond ETF,ARCX,BBG00ZGX8904,FIGB,ETF
True,0002064124,BBG01NGH78G1,usd,2025-09-21T06:04:50.627199722Z,us,stocks,"Figure Technology Solutions, Inc. Class A Common Stock",XNAS,BBG01NGH78K6,FIGR,CS
True,0001846576,BBG004SK5VL9,usd,2025-09-21T06:04:50.627199943Z,us,stocks,"FIGS, Inc.",XNYS,BBG004SK5VM8,FIGS,CS
True,0002059033,,usd,2025-09-21T06:04:50.627200023Z,us,stocks,FIGX Capital Acquisition Corp. Class A Ordinary Share,XNAS,,FIGX,CS
True,0002059033,,usd,2025-09-21T06:04:50.627200143Z,us,stocks,FIGX Capital Acquisition Corp. Units,XNAS,,FIGXU,UNIT
True,0002059033,,usd,2025-09-21T06:04:50.627200223Z,us,stocks,FIGX Capital Acquisition Corp. Warrant,XNAS,,FIGXW,WARRANT
True,0001636639,,usd,2025-09-21T06:04:50.627200303Z,us,stocks,Fidelis Insurance Holdings Limited,XNYS,,FIHL,CS
True,0001517936,BBG01HPQFCW8,usd,2025-09-21T06:04:50.627200383Z,us,stocks,First Trust Intermediate Duration Investment Grade Corporate ETF,ARCX,BBG01HPQFDQ3,FIIG,ETF
True,0001100663,BBG002GKQZG0,usd,2025-09-21T06:04:50.627200464Z,us,stocks,iShares MSCI Global Energy Producers ETF,ARCX,BBG002GKR067,FILL,ETF
True,0001745059,BBG00P48H7P1,usd,2025-09-21T06:04:50.627200534Z,us,stocks,Angel Oak Financial Strategies Income Term Trust,XNYS,BBG00P48H8F0,FINS,FUND
True,,BBG01RBB3ZR2,usd,2025-09-21T06:04:50.627200624Z,us,stocks,Frontier Asset Total International Equity ETF,ARCX,BBG01RBB4132,FINT,ETF
True,0001691445,BBG00HZ6P0P5,usd,2025-09-21T06:04:50.627201005Z,us,stocks,"FinVolution Group American depositary shares, each representing five Class A ordinary shares",XNYS,BBG00HZ6P0Q4,FINV,ADRC
True,0001856365,BBG011VF9YT3,usd,2025-09-21T06:04:50.627201085Z,us,stocks,FinWise Bancorp Common,XNAS,BBG011VF9ZN6,FINW,CS
True,0001432353,BBG00DSB46W3,usd,2025-09-21T06:04:50.627201165Z,us,stocks,Global X Funds Global X FinTech ETF,XNAS,BBG00DSB46V4,FINX,ETF
True,0001899883,BBG0174VKJ51,usd,2025-09-21T06:04:50.627201245Z,us,stocks,FTAI Infrastructure Inc. Common Stock,XNAS,BBG0174VKJB4,FIP,CS
True,0001387131,BBG01QRZH158,usd,2025-09-21T06:04:50.627201325Z,us,stocks,FIRE Funds Income Target ETF,ARCX,BBG01QRZH247,FIRI,ETF
True,0001387131,BBG01QRZNVG3,usd,2025-09-21T06:04:50.627201395Z,us,stocks,FIRE Funds Wealth Builder ETF,ARCX,BBG01QRZNWC5,FIRS,ETF
True,0001136893,BBG000BK2F42,usd,2025-09-21T06:04:50.627201485Z,us,stocks,"Fidelity National Information Services, Inc.",XNYS,BBG001S8SWQ0,FIS,CS
True,0000862831,BBG000BY1L13,usd,2025-09-21T06:04:50.627201726Z,us,stocks,Financial Institutions Inc,XNAS,BBG001SCY2P1,FISI,CS
True,0001553079,BBG005CL7974,usd,2025-09-21T06:04:50.627201806Z,us,stocks,"Empire State Realty OP, L.P. Series 250",ARCX,BBG005CL79Z3,FISK,UNIT
True,0001516212,BBG00NS9WGV4,usd,2025-09-21T06:04:50.627201926Z,us,stocks,SPDR SSGA Fixed Income Sector Rotation ETF,ARCX,BBG00NS9WHL3,FISR,ETF
True,0000035527,BBG000BJL3N0,usd,2025-09-21T06:04:50.627202006Z,us,stocks,Fifth Third Bancorp,XNAS,BBG001S5R6S2,FITB,CS
True,0000035527,,usd,2025-09-21T06:04:50.627202087Z,us,stocks,Fifth Third Bancorp Depositary Shares,XNAS,,FITBI,ADRC
True,0000035527,,usd,2025-09-21T06:04:50.627202167Z,us,stocks,"Fifth Third Bancorp Depositary Shares each representing a 1/1000th ownership interest in a share of Non-Cumulative Perpetual Preferred Stock, Series K",XNAS,,FITBO,CS
True,0000035527,,usd,2025-09-21T06:04:50.627202247Z,us,stocks,"Fifth Third Bancorp Depositary Shares each representing 1/40th share of Fifth Third 6.00% Non-Cumulative Perpetual Class B Preferred Stock, Series A",XNAS,,FITBP,PFD
True,0001081019,BBG00JHP6203,usd,2025-09-21T06:04:50.627202327Z,us,stocks,SPDR S&P Kensho Future Security ETF,ARCX,BBG00JHP62Q5,FITE,ETF
True,0000945908,BBG00JRRWL07,usd,2025-09-21T06:04:50.627202397Z,us,stocks,Fidelity International Value Factor ETF,ARCX,BBG00JRRWLQ9,FIVA,ETF
True,0001177609,BBG001636CR2,usd,2025-09-21T06:04:50.627202477Z,us,stocks,"Five Below, Inc. Common Stock",XNAS,BBG001TCDMY9,FIVE,CS
True,0001288847,BBG001KHJM17,usd,2025-09-21T06:04:50.627202568Z,us,stocks,"FIVE9, INC.",XNAS,BBG001V0P7K7,FIVN,CS
True,,BBG01R76RP30,usd,2025-09-21T06:04:50.627202648Z,us,stocks,YieldMax Dorsey Wright Hybrid 5 Income ETF,XNAS,BBG01R76RQ01,FIVY,ETF
True,,BBG000QJSZL8,usd,2025-09-21T06:04:50.627202738Z,us,stocks,First Trust Water ETF,ARCX,BBG001SS8248,FIW,ETF
True,0001035983,BBG000BWN2Y9,usd,2025-09-21T06:04:50.627202818Z,us,stocks,"Comfort Systems USA, Inc.",XNYS,BBG001SB1GG8,FIX,CS
True,0001667919,BBG00FZ4KFH5,usd,2025-09-21T06:04:50.627202898Z,us,stocks,First Trust Exchange-Traded Fund VIII First Trust Smith Opportunistic Fixed Income ETF,XNAS,BBG00FZ4KG74,FIXD,ETF
True,0001387131,BBG01RXV73W5,usd,2025-09-21T06:04:50.627202968Z,us,stocks,FolioBeyond Enhanced Fixed Income Premium ETF,ARCX,BBG01RXV7587,FIXP,ETF
True,,BBG01THY0YQ9,usd,2025-09-21T06:04:50.627203058Z,us,stocks,TCW Core Plus Bond ETF,XNYS,BBG01THY0ZM0,FIXT,ETF
True,0000069891,BBG000BF8CB6,usd,2025-09-21T06:04:50.627203139Z,us,stocks,National Beverage Corp.,XNAS,BBG001S5PM18,FIZZ,CS
True,0001667919,BBG00YXMPKQ0,usd,2025-09-21T06:04:50.627203219Z,us,stocks,FT Vest U.S. Equity Buffer ETF - January,BATS,BBG00YXMPLL3,FJAN,ETF
True,0001510337,BBG001MKPY33,usd,2025-09-21T06:04:50.627203299Z,us,stocks,First Trust Japan AlphaDEX Fund,XNAS,BBG001V11WW3,FJP,ETF
True,0001667919,BBG00VZR6JH7,usd,2025-09-21T06:04:50.627203399Z,us,stocks,FT Vest U.S. Equity Buffer ETF - July,BATS,BBG00VZR6K84,FJUL,ETF
True,0001667919,BBG00VC9S427,usd,2025-09-21T06:04:50.627203479Z,us,stocks,FT Vest U.S. Equity Buffer ETF - June,BATS,BBG00VC9S4V5,FJUN,ETF
True,0001510337,BBG002N8TF98,usd,2025-09-21T06:04:50.627203559Z,us,stocks,First Trust United Kingdom AlphaDEX Fund,XNAS,BBG002N8TG14,FKU,ETF
True,0000722572,BBG000FS15V4,usd,2025-09-21T06:04:50.62720364Z,us,stocks,Franklin Wireless Corp. Common Stock,XNAS,BBG001SBVBM9,FKWL,CS
True,,BBG01THDN636,usd,2025-09-21T06:04:50.62720372Z,us,stocks,Global X S&P 500 U.S. Market Leaders Top 50 ETF,ARCX,BBG01THDN6Z1,FLAG,ETF
True,0001797318,BBG01M34BY74,usd,2025-09-21T06:04:50.6272038Z,us,stocks,AllianzIM U.S. Equity 6 Month Floor5 Apr/Oct ETF,ARCX,BBG01M34BZB6,FLAO,ETS
True,0001655589,BBG00J3M8WZ9,usd,2025-09-21T06:04:50.62720387Z,us,stocks,Franklin FTSE Australia ETF,ARCX,BBG00J3M8XP8,FLAU,ETF
True,0001655589,BBG00JYXTH81,usd,2025-09-21T06:04:50.62720399Z,us,stocks,Franklin FTSE Asia ex Japan ETF,ARCX,BBG00JYXTHZ1,FLAX,ETF
True,0001655589,BBG00L2CKS28,usd,2025-09-21T06:04:50.62720409Z,us,stocks,Franklin Senior Loan ETF,BATS,BBG00L2CKST9,FLBL,ETF
True,0001655589,BBG00J3M9VQ0,usd,2025-09-21T06:04:50.627204171Z,us,stocks,Franklin FTSE Brazil ETF,ARCX,BBG00J3M9WL3,FLBR,ETF
True,0001245648,BBG000PN2918,usd,2025-09-21T06:04:50.627204251Z,us,stocks,Flaherty & Crumrine Total Return Fund Incorporated,XNYS,BBG001SLJ198,FLC,FUND
True,0001655589,BBG00J3N6M72,usd,2025-09-21T06:04:50.627204331Z,us,stocks,Franklin FTSE Canada ETF,ARCX,BBG00J3N6MY2,FLCA,ETF
True,0001655589,BBG00Q6LNHW1,usd,2025-09-21T06:04:50.627204411Z,us,stocks,Franklin U.S. Core Bond ETF,ARCX,BBG00Q6LNJQ4,FLCB,ETF
True,0001849998,BBG01NK927B6,usd,2025-09-21T06:04:50.627204491Z,us,stocks,Federated Hermes MDT Large Cap Core ETF,ARCX,BBG01NK92888,FLCC,ETF
True,,BBG01RB9SY84,usd,2025-09-21T06:04:50.627204571Z,us,stocks,Frontier Asset U.S. Large Cap Equity ETF,ARCX,BBG01RB9SZ72,FLCE,ETF
True,0001849998,BBG01NKB1C49,usd,2025-09-21T06:04:50.627204651Z,us,stocks,Federated Hermes MDT Large Cap Growth ETF,ARCX,BBG01NKB1D38,FLCG,ETF
True,0001655589,BBG00J3MD154,usd,2025-09-21T06:04:50.627204732Z,us,stocks,Franklin FTSE China ETF,ARCX,BBG00J3MD1W4,FLCH,ETF
True,0001655589,BBG00DVZWNP6,usd,2025-09-21T06:04:50.627204812Z,us,stocks,Franklin Investment Grade Corporate ETF,ARCX,BBG00DVZWNQ5,FLCO,ETF
True,0001849998,BBG01NK8CP18,usd,2025-09-21T06:04:50.627204892Z,us,stocks,Federated Hermes MDT Large Cap Value ETF,ARCX,BBG01NK8CPX3,FLCV,ETF
True,0001889123,BBG0142PTRC8,usd,2025-09-21T06:04:50.627204972Z,us,stocks,"Fold Holdings, Inc. Class A Common Stock",XNAS,BBG0142PTS63,FLD,CS
True,0001562565,BBG01LH0LYH7,usd,2025-09-21T06:04:50.627205052Z,us,stocks,Fidelity Low Duration Bond ETF,XNAS,BBG01LH0LZB0,FLDB,ETF
True,0001889123,BBG0154LPFW0,usd,2025-09-21T06:04:50.627205132Z,us,stocks,"Fold Holdings, Inc. Warrant",XNAS,,FLDDW,WARRANT
True,0001562565,BBG00L4J99Z0,usd,2025-09-21T06:04:50.627205213Z,us,stocks,Fidelity Low Duration Bond Factor ETF,BATS,BBG00L4J9BR4,FLDR,ETF
True,0001776878,BBG01VJKDP41,usd,2025-09-21T06:04:50.627205293Z,us,stocks,RiverNorth Patriot ETF,BATS,BBG01VJKDQ76,FLDZ,ETF
True,0001655589,BBG00J3PR1S7,usd,2025-09-21T06:04:50.627205373Z,us,stocks,Franklin FTSE Europe ETF,ARCX,BBG00J3PR2H7,FLEE,ETF
True,0001655589,BBG00J3PR6Q8,usd,2025-09-21T06:04:50.627205453Z,us,stocks,Franklin FTSE Eurozone ETF,ARCX,BBG00J3PR7F8,FLEU,ETF
True,0000866374,,usd,2025-09-21T06:04:50.627205573Z,us,stocks,Flex Ltd. Ordinary Shares,XNAS,,FLEX,CS
True,0000910073,BBG000BVXPZ8,usd,2025-09-21T06:04:50.627205653Z,us,stocks,"Flagstar Financial, Inc.",XNYS,BBG001SD32Z2,FLG,CS
True,0001655589,BBG00J3PQYB4,usd,2025-09-21T06:04:50.627205734Z,us,stocks,Franklin FTSE United Kingdom ETF,ARCX,BBG00J3PQZ12,FLGB,ETF
True,0001790169,BBG00Z85YJH5,usd,2025-09-21T06:04:50.627205814Z,us,stocks,Flora Growth Corp. Common Stock,XNAS,BBG00Z85YKB8,FLGC,CS
True,0001655589,BBG00J3MNNR1,usd,2025-09-21T06:04:50.627205894Z,us,stocks,Franklin FTSE Germany ETF,ARCX,BBG00J3MNPG8,FLGR,ETF
True,0001674930,BBG00DR7LTG2,usd,2025-09-21T06:04:50.627205974Z,us,stocks,"Fulgent Genetics, Inc. Common Stock",XNAS,BBG00DW0QQM5,FLGT,CS
True,0001655589,BBG00V7V3M12,usd,2025-09-21T06:04:50.627206054Z,us,stocks,Franklin U.S. Treasury Bond ETF,ARCX,BBG00V7V3MT2,FLGV,ETF
True,0000910073,,usd,2025-09-21T06:04:50.627206134Z,us,stocks,"Flagstar Financial, Inc. Depositary shares, each representing a 1/40th interest in a share of Fixed-to-Floating Rate Series A Noncumulative Perpetual Preferred Stock",XNYS,,FLGpA,PFD
True,0000910073,,usd,2025-09-21T06:04:50.627206214Z,us,stocks,"Flagstar Financial, Inc. Bifurcated Option Note Unit SecuritiES",XNYS,,FLGpU,SP
True,0001655589,BBG00L2CL634,usd,2025-09-21T06:04:50.627206295Z,us,stocks,Franklin High Yield Corporate ETF,BATS,BBG00L2CL6V3,FLHY,ETF
True,0001655589,BBG00L2CLBL3,usd,2025-09-21T06:04:50.627206365Z,us,stocks,Franklin International Aggregate Bond ETF,BATS,BBG00L2CLCB2,FLIA,ETF
True,0001655589,BBG00JYWBHT9,usd,2025-09-21T06:04:50.627206455Z,us,stocks,Franklin FTSE India ETF,ARCX,BBG00JYWBLK9,FLIN,ETF
True,0001655589,BBG00J3MMYR8,usd,2025-09-21T06:04:50.627206535Z,us,stocks,Franklin FTSE Japan Hedged ETF,ARCX,BBG00J3MMZG7,FLJH,ETF
True,0001797318,BBG01L88DQ13,usd,2025-09-21T06:04:50.627206615Z,us,stocks,AllianzIM U.S. Equity 6 Month Floor5 Jan/Jul ETF,ARCX,BBG01L88DQW9,FLJJ,ETS
True,0001655589,BBG00J3MDY16,usd,2025-09-21T06:04:50.627206695Z,us,stocks,Franklin FTSE Japan ETF,ARCX,BBG00J3MDYR8,FLJP,ETF
True,0001655589,BBG00J3N5BB2,usd,2025-09-21T06:04:50.627206776Z,us,stocks,Franklin FTSE South Korea ETF,ARCX,BBG00J3N5C11,FLKR,ETF
True,0000891482,BBG000BHSGF7,usd,2025-09-21T06:04:50.627206856Z,us,stocks,"Full House Resorts, Inc.",XNAS,BBG001S7D9G0,FLL,CS
True,0001655589,BBG00M6PPS91,usd,2025-09-21T06:04:50.627206936Z,us,stocks,Franklin FTSE Latin America,ARCX,BBG00M6PPT17,FLLA,ETF
True,0001655589,BBG00HLJ9XK3,usd,2025-09-21T06:04:50.627207026Z,us,stocks,Franklin Municipal Green Bond ETF,ARCX,BBG00HLJ9Y85,FLMB,ETF
True,0001655589,BBG00HLJ4L24,usd,2025-09-21T06:04:50.627207106Z,us,stocks,Franklin Dynamic Municipal Bond ETF,ARCX,BBG00HLJ4LS6,FLMI,ETF
True,0001655589,BBG00J3MSMP0,usd,2025-09-21T06:04:50.627207186Z,us,stocks,Franklin FTSE Mexico ETF,ARCX,BBG00J3MSND1,FLMX,ETF
True,0001510337,BBG001MKNCN1,usd,2025-09-21T06:04:50.627207266Z,us,stocks,First Trust Latin America AlphaDEX Fund,XNAS,BBG001V11WB6,FLN,ETF
True,0001868941,BBG012QSDSK6,usd,2025-09-21T06:04:50.627207347Z,us,stocks,"Fluence Energy, Inc. Class A Common Stock",XNAS,BBG012QSDTD2,FLNC,CS
True,0001772253,,usd,2025-09-21T06:04:50.627207427Z,us,stocks,FLEX LNG Ltd. Ordinary Shares,XNYS,,FLNG,CS
True,0001460329,BBG000TWSVB6,usd,2025-09-21T06:04:50.627207507Z,us,stocks,"Fluent, Inc. Common Stock",XNAS,BBG001T0NKV1,FLNT,CS
True,0001128928,BBG000BB4D72,usd,2025-09-21T06:04:50.627207587Z,us,stocks,"Flowers Foods, Inc.",XNYS,BBG001S5R7L7,FLO,CS
True,0002035149,BBG01R6F2N88,usd,2025-09-21T06:04:50.627207667Z,us,stocks,Flowco Holdings Inc.,XNYS,BBG01R6F2P38,FLOC,CS
True,0001100663,BBG001QWVB81,usd,2025-09-21T06:04:50.627207747Z,us,stocks,iShares Floating Rate Bond ETF,BATS,BBG001V1QYX1,FLOT,ETF
True,,BBG01H7RNK95,usd,2025-09-21T06:04:50.627207828Z,us,stocks,Global X U.S. Cash Flow Kings 100 ETF,ARCX,BBG01H7RNL57,FLOW,ETF
True,0001655589,BBG00GKQZDZ9,usd,2025-09-21T06:04:50.627207898Z,us,stocks,Franklin U.S. Large Cap Multifactor Index ETF,BATS,BBG00GKQZFP5,FLQL,ETF
True,0001655589,BBG00GKQZHB6,usd,2025-09-21T06:04:50.627207988Z,us,stocks,Franklin U.S. Mid Cap Multifactor Index ETF,BATS,BBG00GKQZJ13,FLQM,ETF
True,0001655589,BBG00GKQZLJ9,usd,2025-09-21T06:04:50.627208058Z,us,stocks,Franklin U.S. Small Cap Multifactor Index ETF,BATS,BBG00GKQZM70,FLQS,ETF
True,0001124198,BBG000BB1TH9,usd,2025-09-21T06:04:50.627208138Z,us,stocks,Fluor Corporation,XNYS,BBG001S5Q738,FLR,CS
True,0000945908,BBG00XCCSCY3,usd,2025-09-21T06:04:50.627208218Z,us,stocks,Fidelity U.S. Multifactor ETF,ARCX,BBG00XCCSDS8,FLRG,ETF
True,0001064642,BBG0029J2H86,usd,2025-09-21T06:04:50.627208439Z,us,stocks,SPDR Bloomberg Investment Grade Floating Rate ETF,ARCX,BBG0029J2J00,FLRN,ETF
True,0001616668,BBG01357YF73,usd,2025-09-21T06:04:50.627208519Z,us,stocks,Pacer Aristotle Pacific Floating Rate High Income ETF,ARCX,BBG01357YF82,FLRT,ETF
True,0000030625,BBG000FFH4P5,usd,2025-09-21T06:04:50.627208789Z,us,stocks,Flowserve Corporation,XNYS,BBG001SB3F87,FLS,CS
True,0001655589,BBG00M6PPK25,usd,2025-09-21T06:04:50.62720888Z,us,stocks,Franklin FTSE Saudi Arabia ETF,ARCX,BBG00M6PPKT6,FLSA,ETF
True,0001655589,BBG00R2LVKF6,usd,2025-09-21T06:04:50.62720896Z,us,stocks,Franklin Systematic Style Premia ETF,ARCX,BBG00R2LVL55,FLSP,ETF
True,0001655589,BBG00JYXTYC9,usd,2025-09-21T06:04:50.62720905Z,us,stocks,Franklin FTSE Switzerland ETF,ARCX,BBG00JYXTZ27,FLSW,ETF
True,0001562565,BBG0078XLZ84,usd,2025-09-21T06:04:50.62720913Z,us,stocks,Fidelity Limited Term Bond ETF,ARCX,BBG0078XLZ93,FLTB,ETF
True,0001137360,BBG001NKQWL5,usd,2025-09-21T06:04:50.62720921Z,us,stocks,VanEck IG Floating Rate ETF,ARCX,BBG001V14Q53,FLTR,ETF
True,0001655589,BBG00J3PQ956,usd,2025-09-21T06:04:50.62720929Z,us,stocks,Franklin FTSE Taiwan ETF,ARCX,BBG00J3PQ9W6,FLTW,ETF
True,0001655589,BBG00W28C0D1,usd,2025-09-21T06:04:50.62720937Z,us,stocks,Franklin Ultra Short Bond ETF,ARCX,BBG00W28C158,FLUD,ETF
True,0001635327,,usd,2025-09-21T06:04:50.627209451Z,us,stocks,Flutter Entertainment plc,XNYS,,FLUT,CS
True,0001083743,BBG000CKGHF0,usd,2025-09-21T06:04:50.627209531Z,us,stocks,"Flux Power Holdings, Inc. Common Stock",XNAS,BBG001SF5MW4,FLUX,CS
True,0001710607,BBG00RJWH3L1,usd,2025-09-21T06:04:50.627209611Z,us,stocks,American Century Focused Large Cap Value ETF,ARCX,BBG00RJWH4B0,FLV,ETF
True,0001084869,BBG000BBR9P6,usd,2025-09-21T06:04:50.627209691Z,us,stocks,1-800-FLOWERS.COM Inc,XNAS,BBG001S60YV4,FLWS,CS
True,0001858724,BBG01PR6H0V7,usd,2025-09-21T06:04:50.627209771Z,us,stocks,BingEx Limited American Depositary Shares,XNAS,BBG01PR6H1P2,FLX,ADRC
True,,BBG01VRMV9C5,usd,2025-09-21T06:04:50.627209851Z,us,stocks,Horizon Flexible Income ETF,BATS,BBG01VRMVBC0,FLXN,ETF
True,0001831313,BBG01NCF0GV1,usd,2025-09-21T06:04:50.627209932Z,us,stocks,TCW Flexible Income ETF,XNYS,BBG01NCF0HQ5,FLXR,ETF
True,0000037472,BBG000BJNBB3,usd,2025-09-21T06:04:50.627210012Z,us,stocks,Flexsteel Industries,XNAS,BBG001S5R835,FLXS,CS
True,0001860160,BBG00NGNL3X5,usd,2025-09-21T06:04:50.627210092Z,us,stocks,Firefly Aerospace Inc. Common Stock,XNAS,BBG00NGNL3Y4,FLY,CS
True,0000927971,BBG013KKRB29,usd,2025-09-21T06:04:50.627210172Z,us,stocks,MicroSectors Travel -3x Inverse Leveraged ETN,ARCX,BBG013KKRBY4,FLYD,ETN
True,0001975940,BBG01LBH4R35,usd,2025-09-21T06:04:50.627210282Z,us,stocks,"Fly-E Group, Inc. Common Stock",XNAS,BBG01LBH4RY1,FLYE,CS
True,0000927971,BBG013KKMM39,usd,2025-09-21T06:04:50.627210372Z,us,stocks,MicroSectors Travel 3x Leveraged ETN,ARCX,BBG013KKMN55,FLYU,ETN
True,0001580560,BBG002030NC4,usd,2025-09-21T06:04:50.627210453Z,us,stocks,Flywire Corporation Voting Common Stock,XNAS,BBG002030ND3,FLYW,CS
True,0001843973,BBG00ZXXLTZ8,usd,2025-09-21T06:04:50.627210533Z,us,stocks,"flyExclusive, Inc.",XASE,BBG00ZXXLVV7,FLYX,CS
True,0001843973,BBG00ZXY2JV3,usd,2025-09-21T06:04:50.627210623Z,us,stocks,"flyExclusive, Inc. Redeemable warrants, each whole warrant exercisable for one Class A common stock at an exercise price of $11.50 per share",XASE,,FLYX.WS,WARRANT
True,0000945908,BBG00Z4JDQL1,usd,2025-09-21T06:04:50.627210693Z,us,stocks,Fidelity Magellan ETF,BATS,BBG00Z4JDRF6,FMAG,ETF
True,0000792966,BBG000BLPL88,usd,2025-09-21T06:04:50.627210773Z,us,stocks,"Farmers & Merchants Bancorp, Inc.",XNAS,BBG001S8HL40,FMAO,CS
True,0001667919,BBG00ZR06728,usd,2025-09-21T06:04:50.627210853Z,us,stocks,FT Vest U.S. Equity Buffer ETF - March,BATS,BBG00ZR067X4,FMAR,ETF
True,0000945908,BBG005FHWDH2,usd,2025-09-21T06:04:50.627210933Z,us,stocks,Fidelity MSCI Materials Index ETF,ARCX,BBG005FHWDJ0,FMAT,ETF
True,0001667919,BBG00TSG25H8,usd,2025-09-21T06:04:50.627211014Z,us,stocks,FT Vest U.S. Equity Buffer ETF - May,BATS,BBG00TSG2686,FMAY,ETF
True,,BBG006H1W517,usd,2025-09-21T06:04:50.627211094Z,us,stocks,First Trust Managed Municipal ETF,XNAS,BBG006H1W526,FMB,ETF
True,0000700565,BBG000BD8VT0,usd,2025-09-21T06:04:50.627211174Z,us,stocks,"First Mid Bancshares, Inc. Common Stock",XNAS,BBG001S704Q4,FMBH,CS
True,0000037785,BBG000BJP882,usd,2025-09-21T06:04:50.627211394Z,us,stocks,FMC Corporation,XNYS,BBG001S5R880,FMC,CS
True,,BBG01QMWMTV4,usd,2025-09-21T06:04:50.627211475Z,us,stocks,FM Compounders Equity ETF,ARCX,BBG01QMWMVW8,FMCE,ETF
True,0001733356,BBG016Y0X448,usd,2025-09-21T06:04:50.627211595Z,us,stocks,FM Focus Equity ETF,ARCX,BBG016Y0X4Z4,FMCX,ETF
True,0000945908,BBG01K785Q33,usd,2025-09-21T06:04:50.627211675Z,us,stocks,Fidelity Enhanced Mid Cap ETF,ARCX,BBG01K785QY9,FMDE,ETF
True,0000945908,BBG01GXLXWJ3,usd,2025-09-21T06:04:50.627211755Z,us,stocks,Fidelity Disruptive Medicine ETF,XNAS,BBG01GXLXXD7,FMED,ETF
True,0000945908,BBG016VBYBR5,usd,2025-09-21T06:04:50.627211835Z,us,stocks,Fidelity Metaverse ETF,XNAS,BBG016VBYCL9,FMET,ETF
True,0001549548,BBG004XDZ7N7,usd,2025-09-21T06:04:50.627211915Z,us,stocks,First Trust Managed Futures Strategy Fund,ARCX,BBG004XDZ7P5,FMF,ETF
True,0002024656,,usd,2025-09-21T06:04:50.627211995Z,us,stocks,Kandal M Venture Limited Class A Ordinary Shares,XNAS,,FMFC,CS
True,0001424212,BBG00J3TCPQ4,usd,2025-09-21T06:04:50.627212076Z,us,stocks,First Trust Municipal High Income ETF,XNAS,BBG00J3TCQF4,FMHI,ETF
True,0001387131,BBG01VFQP6V1,usd,2025-09-21T06:04:50.627212156Z,us,stocks,The Free Markets ETF,ARCX,BBG01VFQP8L8,FMKT,ETF
True,0001199004,BBG000CTZS48,usd,2025-09-21T06:04:50.627212236Z,us,stocks,Federated Hermes Premier Municipal Income Fund,XNYS,BBG001SFSHM1,FMN,FUND
True,0000709337,BBG000D9HD17,usd,2025-09-21T06:04:50.627212316Z,us,stocks,Farmers National Banc Corp,XNAS,BBG001S7S1W3,FMNB,CS
True,0001424212,BBG010WQLK25,usd,2025-09-21T06:04:50.627212396Z,us,stocks,First Trust New York Municipal High Income ETF,ARCX,BBG010WQLL32,FMNY,ETF
True,0001452937,BBG012G1S575,usd,2025-09-21T06:04:50.627212476Z,us,stocks,FMQQ The Next Frontier Internet ETF,ARCX,BBG012G1S646,FMQQ,ETF
