active,cik,composite_figi,currency_name,last_updated_utc,locale,market,name,primary_exchange,share_class_figi,ticker,type
True,0001090872,BBG000C2V3D6,usd,2025-09-21T06:04:50.62682634Z,us,stocks,Agilent Technologies Inc.,XNYS,BBG001SCTQY4,A,CS
True,0001675149,BBG00B3T3HD3,usd,2025-09-21T06:04:50.626826971Z,us,stocks,Alcoa Corporation,XNYS,BBG00B3T3HF1,AA,CS
True,0001776878,BBG01B0JRCS6,usd,2025-09-21T06:04:50.626827222Z,us,stocks,Alternative Access First Priority CLO Bond ETF,ARCX,BBG01B0JRCT5,AAA,ETF
True,,BBG01W275XX6,usd,2025-09-21T06:04:50.626827482Z,us,stocks,Amplius Aggressive Asset Allocation ETF,BATS,BBG01W275ZB5,AAAA,ETF
True,0001708646,BBG00LPXX872,usd,2025-09-21T06:04:50.626827562Z,us,stocks,Goldman Sachs Physical Gold ETF Shares,BATS,BBG00LPXX8Z1,AAAU,ETF
True,0002034334,,usd,2025-09-21T06:04:50.626827813Z,us,stocks,Artius II Acquisition Inc. Class A Ordinary Shares,XNAS,,AACB,CS
True,0002034334,,usd,2025-09-21T06:04:50.626828013Z,us,stocks,Artius II Acquisition Inc. Rights,XNAS,,AACBR,RIGHT
True,0002034334,,usd,2025-09-21T06:04:50.626828203Z,us,stocks,Artius II Acquisition Inc. Units,XNAS,,AACBU,UNIT
True,0001420529,BBG000V2S3P6,usd,2025-09-21T06:04:50.626828384Z,us,stocks,ATA Creativity Global American Depositary Shares,XNAS,BBG001T125S9,AACG,ADRC
True,0002044009,,usd,2025-09-21T06:04:50.626828474Z,us,stocks,Armada Acquisition Corp. II Class A Ordinary Shares,XNAS,,AACI,CS
True,0002044009,,usd,2025-09-21T06:04:50.626828744Z,us,stocks,Armada Acquisition Corp. II Units,XNAS,,AACIU,UNIT
True,0002044009,,usd,2025-09-21T06:04:50.626828825Z,us,stocks,Armada Acquisition Corp. II Warrant,XNAS,,AACIW,WARRANT
True,0001853138,,usd,2025-09-21T06:04:50.626828975Z,us,stocks,Ares Acquisition Corporation II,XNYS,,AACT,CS
True,0001853138,,usd,2025-09-21T06:04:50.626829055Z,us,stocks,"Ares Acquisition Corporation II Units, each consisting of one Class A ordinary share and one-half of one redeemable warrant",XNYS,,AACT.U,UNIT
True,0001853138,,usd,2025-09-21T06:04:50.626829135Z,us,stocks,"Ares Acquisition Corporation II Redeemable Warrants, each whole warrant exercisable for one Class A ordinary share at an exercise price of $11.50",XNYS,,AACT.WS,WARRANT
True,0001408970,BBG000BDYRW6,usd,2025-09-21T06:04:50.626829215Z,us,stocks,AdvisorShares Dorsey Wright ADR ETF,XNAS,BBG001T9B1Y4,AADR,ETF
True,0000006201,BBG005P7Q881,usd,2025-09-21T06:04:50.626829295Z,us,stocks,American Airlines Group Inc.,XNAS,BBG005P7Q907,AAL,CS
True,0001976322,BBG01VH49P35,usd,2025-09-21T06:04:50.626829376Z,us,stocks,Leverage Shares 2X Long AAL Daily ETF,XNAS,BBG01VH49Q06,AALG,ETF
True,0002012964,,usd,2025-09-21T06:04:50.626829666Z,us,stocks,AA Mission Acquisition Corp.,XNYS,,AAM,CS
True,0002012964,,usd,2025-09-21T06:04:50.626829746Z,us,stocks,"AA Mission Acquisition Corp. Units, each consisting of one Class A Ordinary Share and one-half of one redeemable warrant",XNYS,,AAM.U,UNIT
True,0002012964,,usd,2025-09-21T06:04:50.626829877Z,us,stocks,"AA Mission Acquisition Corp. Warrants, each whole warrant entitles the holder to purchase one Class A ordinary share at a price of $11.50 per share",XNYS,,AAM.WS,WARRANT
True,0000008177,BBG000B9XB24,usd,2025-09-21T06:04:50.626829957Z,us,stocks,Atlantic American Corp,XNAS,BBG001S5N8T1,AAME,CS
True,0001748824,BBG00P2HLNY3,usd,2025-09-21T06:04:50.626830037Z,us,stocks,Acadian Asset Management Inc.,XNYS,BBG00P2HLNZ2,AAMI,CS
True,0001158114,BBG000D6VW15,usd,2025-09-21T06:04:50.626830117Z,us,stocks,"Applied Optoelectronics, Inc.",XNAS,BBG001SG47G4,AAOI,CS
True,0000824142,BBG000C2LZP3,usd,2025-09-21T06:04:50.626830317Z,us,stocks,Aaon Inc,XNAS,BBG001S6CZK0,AAON,CS
True,0001158449,BBG000F7RCJ1,usd,2025-09-21T06:04:50.626830398Z,us,stocks,ADVANCE AUTO PARTS INC,XNYS,BBG001SD2SB2,AAP,CS
True,0001689873,BBG0193F21N2,usd,2025-09-21T06:04:50.626830468Z,us,stocks,GraniteShares ETF Trust GraniteShares 2x Long AAPL Daily ETF,XNAS,BBG0193F22H7,AAPB,ETF
True,,BBG0193YGJ57,usd,2025-09-21T06:04:50.626830558Z,us,stocks,Direxion Daily AAPL Bear 1X Shares,XNAS,BBG0193YGK09,AAPD,ETF
True,0002023311,BBG01RJXM9C9,usd,2025-09-21T06:04:50.626830638Z,us,stocks,Ascentage Pharma Group International American Depository Shares,XNAS,BBG01RJXMB89,AAPG,ADRC
True,0000320193,BBG000B9XRY4,usd,2025-09-21T06:04:50.626830718Z,us,stocks,Apple Inc.,XNAS,BBG001S5N8V8,AAPL,CS
True,0001415726,BBG01M698CQ1,usd,2025-09-21T06:04:50.626830798Z,us,stocks,Innovator Equity Defined Protection ETF - 2 Yr to April 2026,BATS,BBG01M698DK5,AAPR,ETF
True,,BBG0193YBZ92,usd,2025-09-21T06:04:50.626830879Z,us,stocks,Direxion Shares ETF Trust Direxion Daily AAPL Bull 2X Shares,XNAS,BBG0193YC043,AAPU,ETF
True,,BBG01SCFVRC3,usd,2025-09-21T06:04:50.626830959Z,us,stocks,Roundhill AAPL WeeklyPay ETF,BATS,BBG01SCFVS86,AAPW,ETF
True,,BBG01KY72SD3,usd,2025-09-21T06:04:50.626831039Z,us,stocks,T-Rex 2X Long Apple Daily Target ETF,BATS,BBG01KY72T78,AAPX,ETF
True,0001848758,BBG01QY0GMH9,usd,2025-09-21T06:04:50.626831259Z,us,stocks,Kurv Yield Premium Strategy Apple (AAPL) ETF,BATS,BBG01QY0GNH7,AAPY,ETF
True,0001774857,BBG01223DLB2,usd,2025-09-21T06:04:50.626831339Z,us,stocks,"Aardvark Therapeutics, Inc. Common Stock",XNAS,BBG01223DLC1,AARD,CS
True,0001500217,BBG00161BCR0,usd,2025-09-21T06:04:50.6268316Z,us,stocks,"AMERICAN ASSETS TRUST, INC.",XNYS,BBG001TCBJS5,AAT,CS
True,0001993344,BBG01K0WWT59,usd,2025-09-21T06:04:50.62683168Z,us,stocks,Allied Gold Corporation,XNYS,BBG01J3PPZ58,AAUC,CS
True,,BBG01W26H9C1,usd,2025-09-21T06:04:50.62683175Z,us,stocks,Alpha Architect US Equity ETF,XNAS,BBG01W26HBL6,AAUS,ETF
True,,BBG00GM1DQV1,usd,2025-09-21T06:04:50.62683183Z,us,stocks,EA Series Trust Alpha Architect Global Factor Equity ETF,XNAS,BBG00GM1DRK1,AAVM,ETF
True,0001100663,BBG000G6GXC5,usd,2025-09-21T06:04:50.62683192Z,us,stocks,iShares MSCI All Country Asia ex Japan ETF,XNAS,BBG001T2V2D8,AAXJ,ETF
True,0000825313,BBG000B9WM03,usd,2025-09-21T06:04:50.626831991Z,us,stocks,"AllianceBernstein Holding, L.P.",XNYS,BBG001S5N9S0,AB,CS
True,0001576873,BBG004M1KJN5,usd,2025-09-21T06:04:50.626832071Z,us,stocks,American Battery Technology Company Common Stock,XNAS,BBG004M1KJP3,ABAT,CS
True,0001551152,BBG0025Y4RY4,usd,2025-09-21T06:04:50.626832151Z,us,stocks,ABBVIE INC.,XNYS,BBG0025Y4RZ3,ABBV,CS
True,0000351569,BBG000CDY3H5,usd,2025-09-21T06:04:50.626832231Z,us,stocks,Ameris Bancorp,XNYS,BBG001S80PX7,ABCB,CS
True,0001703057,BBG00LLW2MF2,usd,2025-09-21T06:04:50.626832321Z,us,stocks,AbCellera Biologics Inc. Common Shares,XNAS,BBG00LLW2MH0,ABCL,CS
True,,BBG01KMFQRF2,usd,2025-09-21T06:04:50.626832401Z,us,stocks,Alpha Blue Capital US Small-Mid Cap Dynamic ETF,XNAS,BBG01KMFQS88,ABCS,ETF
True,0000318306,BBG000DT5D52,usd,2025-09-21T06:04:50.626832482Z,us,stocks,Abeona Therapeutics Inc. Common Stock,XNAS,BBG001S8T7K0,ABEO,CS
True,0001199046,BBG00RHHGQY2,usd,2025-09-21T06:04:50.626832562Z,us,stocks,Absolute Select Value ETF,ARCX,BBG00RHHGRP0,ABEQ,ETF
True,0001565025,BBG000BN5VZ4,usd,2025-09-21T06:04:50.626832642Z,us,stocks,AMBEV S.A.,XNYS,BBG005KLVT74,ABEV,ADRC
True,,BBG00DW3P010,usd,2025-09-21T06:04:50.626832842Z,us,stocks,Abacus FCF Leaders ETF,BATS,BBG00DW3P029,ABFL,ETF
True,0001144980,BBG000BKDWB5,usd,2025-09-21T06:04:50.626832932Z,us,stocks,"Asbury Automotive Group, Inc.",XNYS,BBG001S9B5H5,ABG,CS
True,,BBG01VCKWDB6,usd,2025-09-21T06:04:50.626833053Z,us,stocks,VictoryShares Pioneer Asset-Based Income ETF,XNAS,BBG01VCKWFN8,ABI,ETF
True,,BBG01TCJ3701,usd,2025-09-21T06:04:50.626833133Z,us,stocks,Argent Large Cap ETF,XNAS,BBG01TCJ37Z3,ABIG,ETF
True,0001814287,BBG00VY1KB95,usd,2025-09-21T06:04:50.626833203Z,us,stocks,"Abacus Global Management, Inc. Class A Common Stock",XNAS,BBG00VY1KBC1,ABL,CS
True,,BBG0141PBK24,usd,2025-09-21T06:04:50.626833293Z,us,stocks,Abacus FCF Real Assets Leaders ETF,BATS,BBG0141PBL04,ABLD,ETF
True,,BBG00H1J5D96,usd,2025-09-21T06:04:50.626833363Z,us,stocks,Abacus FCF International Leaders ETF,BATS,BBG00H1J5FN5,ABLG,ETF
True,0001814287,,usd,2025-09-21T06:04:50.626833453Z,us,stocks,"Abacus Global Management, Inc. 9.875% Fixed Rate Senior Notes due 2028",XNAS,,ABLLL,CS
True,,BBG01SCGBTV8,usd,2025-09-21T06:04:50.626833524Z,us,stocks,Abacus FCF Small Cap Leaders ETF,BATS,BBG01SCGBVT6,ABLS,ETF
True,0001957489,,usd,2025-09-21T06:04:50.626833604Z,us,stocks,Able View Global Inc. Class B Ordinary Shares,XNAS,,ABLV,CS
True,0001957489,,usd,2025-09-21T06:04:50.626833684Z,us,stocks,Able View Global Inc. Warrant,XNAS,,ABLVW,WARRANT
True,0000771497,BBG000B9YYH7,usd,2025-09-21T06:04:50.626833764Z,us,stocks,"ABM Industries, Inc.",XNYS,BBG001S5N9B8,ABM,CS
True,0001559720,BBG001Y2XS07,usd,2025-09-21T06:04:50.626833844Z,us,stocks,"Airbnb, Inc. Class A Common Stock",XNAS,BBG001Y2XS16,ABNB,CS
True,,BBG01JHFMD75,usd,2025-09-21T06:04:50.626833934Z,us,stocks,YieldMax ABNB Option Income Strategy ETF,ARCX,BBG01JHFMF34,ABNY,ETS
True,0001576885,BBG0058YJ317,usd,2025-09-21T06:04:50.626834014Z,us,stocks,"Acumen Pharmaceuticals, Inc. Common Stock",XNAS,BBG0058YJ326,ABOS,CS
True,,BBG00YC69CJ2,usd,2025-09-21T06:04:50.626834095Z,us,stocks,Abacus FCF Innovation Leaders ETF,BATS,BBG00YC69DC7,ABOT,ETF
True,0001893219,BBG013X0S7F3,usd,2025-09-21T06:04:50.626834345Z,us,stocks,"Abpro Holdings, Inc Common Stock",XNAS,BBG013X0S889,ABP,CS
True,,BBG0142NHSW2,usd,2025-09-21T06:04:50.626834425Z,us,stocks,"Abpro Holdings, Inc. Warrant",XNAS,,ABPWW,WARRANT
True,0001253986,BBG000KMVDV1,usd,2025-09-21T06:04:50.626834546Z,us,stocks,"Arbor Realty Trust, Inc.",XNYS,BBG001SJP3G4,ABR,CS
True,0001253986,,usd,2025-09-21T06:04:50.626834636Z,us,stocks,"Arbor Realty Trust, Inc. 6.375% Series D Cumulative Redeemable Preferred Stock, Liquidation Preference $25.00 per Share",XNYS,,ABRpD,PFD
True,0001253986,,usd,2025-09-21T06:04:50.626834706Z,us,stocks,"Arbor Realty Trust, Inc. 6.25% Series E Cumulative Redeemable Preferred Stock",XNYS,,ABRpE,PFD
True,0001253986,,usd,2025-09-21T06:04:50.626834786Z,us,stocks,"Arbor Realty Trust, Inc. 6.25% Series F Fixed-to-Floating Rate Cumulative Redeemable Preferred Stock, Liquidation Preference $25.00 per share",XNYS,,ABRpF,PFD
True,0001672688,BBG011N54CJ8,usd,2025-09-21T06:04:50.626834866Z,us,stocks,Absci Corporation Common Stock,XNAS,BBG011N54DC3,ABSI,CS
True,0000001800,BBG000B9ZXB4,usd,2025-09-21T06:04:50.626834946Z,us,stocks,Abbott Laboratories,XNYS,BBG001S5N9M6,ABT,CS
True,0001755953,BBG00MS8GZP1,usd,2025-09-21T06:04:50.626835036Z,us,stocks,American Bitcoin Corp. Class A Common Stock,XNAS,BBG00MS8GZQ0,ABTC,CS
True,0001864055,,usd,2025-09-21T06:04:50.626835127Z,us,stocks,Abits Group Inc Ordinary Shares,XNAS,,ABTS,CS
True,0001447028,BBG000RR8V85,usd,2025-09-21T06:04:50.626835197Z,us,stocks,Arbutus Biopharma Corporation Common Stock,XNAS,BBG001S6RSK0,ABUS,CS
True,0001173313,BBG000Q844Z2,usd,2025-09-21T06:04:50.626835287Z,us,stocks,"ABVC BioPharma, Inc. Common Stock",XNAS,BBG001SMCS49,ABVC,CS
True,0001979484,BBG01NGG37N1,usd,2025-09-21T06:04:50.626835367Z,us,stocks,Above Food Ingredients Inc. Common Stock,XNAS,BBG01NGG37P9,ABVE,CS
True,0001979484,BBG01NKYQFV5,usd,2025-09-21T06:04:50.626835447Z,us,stocks,Above Food Ingredients Inc. Warrants,XNAS,,ABVEW,WARRANT
True,0001956827,BBG01JLQNZ03,usd,2025-09-21T06:04:50.626835527Z,us,stocks,Abivax SA American Depositary Shares,XNAS,BBG01JLQNZV9,ABVX,ADRC
True,,BBG00YC5ZT62,usd,2025-09-21T06:04:50.626835608Z,us,stocks,Abacus Flexible Bond Leaders ETF,BATS,BBG00YC5ZV49,ABXB,ETF
True,0001739445,BBG00JGMWFM9,usd,2025-09-21T06:04:50.626835828Z,us,stocks,"Arcosa, Inc. Common Stock",XNYS,BBG00JGMWGB9,ACA,CS
True,0001070494,BBG000BHG9K0,usd,2025-09-21T06:04:50.626835908Z,us,stocks,Acadia Pharmaceuticals Inc.,XNAS,BBG001SB06N3,ACAD,CS
True,0001683541,BBG006SCSYG7,usd,2025-09-21T06:04:50.626836028Z,us,stocks,Aurora Cannabis Inc. Common Shares,XNAS,BBG001SV77D1,ACB,CS
True,0000712034,BBG000J06K07,usd,2025-09-21T06:04:50.626836108Z,us,stocks,Acco Brands Corporation,XNYS,BBG001SPBTK3,ACCO,CS
True,0000843006,BBG000C1CK87,usd,2025-09-21T06:04:50.626836189Z,us,stocks,ACCESS Newswire Inc.,XASE,BBG001S67C09,ACCS,CS
True,0001881487,BBG013PRYPJ2,usd,2025-09-21T06:04:50.626836269Z,us,stocks,ProFrac Holding Corp. Class A Common Stock,XNAS,BBG013PRYQC7,ACDC,CS
True,0001698991,BBG00GX221W3,usd,2025-09-21T06:04:50.626836349Z,us,stocks,"Accel Entertainment, Inc.",XNYS,BBG00GX221Z0,ACEL,CS
True,0001414040,BBG00L99FCT0,usd,2025-09-21T06:04:50.626836429Z,us,stocks,ALPS Clean Energy ETF,ARCX,BBG00L99FDK7,ACES,ETF
True,0001720580,BBG00JCXSJP3,usd,2025-09-21T06:04:50.626836509Z,us,stocks,"Adicet Bio, Inc. Common Stock",XNAS,BBG00JCXSJQ2,ACET,CS
True,0000880984,BBG000CMY866,usd,2025-09-21T06:04:50.626836589Z,us,stocks,"Acorn Energy, Inc. Common Stock",XNAS,BBG001S6ZZ25,ACFN,CS
True,0000947484,,usd,2025-09-21T06:04:50.62683675Z,us,stocks,Arch Capital Group Ltd,XNAS,,ACGL,CS
True,0000947484,,usd,2025-09-21T06:04:50.62683684Z,us,stocks,"Arch Capital Group Ltd. Depositary Shares, each Representing a 1/1,000th Interest in a 4.550% Non-Cumulative Preferred Share, Series G",XNAS,,ACGLN,CS
True,0000947484,,usd,2025-09-21T06:04:50.62683692Z,us,stocks,"Arch Capital Group Ltd. Depositary Shares Each Representing 1/1,000th Interest in a Share of 5.45% Non-Cumulative Preferred Shares, Series F",XNAS,,ACGLO,PFD
True,0001481714,BBG011MFL031,usd,2025-09-21T06:04:50.626837Z,us,stocks,American Century Large Cap Growth ETF,ARCX,BBG011MFL0Y7,ACGR,ETF
True,0001520697,BBG000FPNN38,usd,2025-09-21T06:04:50.62683708Z,us,stocks,"Acadia Healthcare Company, Inc.",XNAS,BBG001SNNWL7,ACHC,CS
True,0001824502,BBG00XRTC910,usd,2025-09-21T06:04:50.62683716Z,us,stocks,Archer Aviation Inc.,XNYS,BBG00XRTC929,ACHR,CS
True,0001824502,BBG00YGCV1N9,usd,2025-09-21T06:04:50.626837361Z,us,stocks,"Archer Aviation Inc. Redeemable Warrants, each whole warrant exercisable for one Class A common stock at an exercise price of $11.50",XNYS,,ACHR.WS,WARRANT
True,0000949858,BBG000FB8S62,usd,2025-09-21T06:04:50.626837451Z,us,stocks,"Achieve Life Sciences, Inc.",XNAS,BBG001S8JF14,ACHV,CS
True,0001646972,BBG009KG1750,usd,2025-09-21T06:04:50.626837551Z,us,stocks,"Albertsons Companies, Inc.",XNYS,BBG009KG1741,ACI,CS
True,0001401521,BBG000TKFJQ7,usd,2025-09-21T06:04:50.626837631Z,us,stocks,American Coastal Insurance Corporation Common Stock,XNAS,BBG001T09W05,ACIC,CS
True,0001539639,BBG00PNSDFF3,usd,2025-09-21T06:04:50.626837712Z,us,stocks,Aptus Collared Investment Opportunity ETF,BATS,BBG00PNSDG52,ACIO,ETF
True,0001651625,,usd,2025-09-21T06:04:50.626837792Z,us,stocks,AC Immune SA,XNAS,,ACIU,CS
True,0000935036,BBG000PMBV39,usd,2025-09-21T06:04:50.626837872Z,us,stocks,"ACI Worldwide, Inc.",XNAS,BBG001S9KLL5,ACIW,CS
True,0001722388,BBG01WHYZLL7,usd,2025-09-21T06:04:50.626837952Z,us,stocks,VistaShares Target 15 ACKtivist Distribution ETF,ARCX,BBG01WHYZMG1,ACKY,ETF
True,0001481714,BBG00W0JV9Q5,usd,2025-09-21T06:04:50.626838032Z,us,stocks,American Century Large Cap Equity ETF,ARCX,BBG00W0JVBH0,ACLC,ETF
True,0001831313,BBG01QPVFLN7,usd,2025-09-21T06:04:50.626838112Z,us,stocks,TCW AAA CLO ETF,XNYS,BBG01QPVFMJ0,ACLO,ETF
True,0001113232,BBG000DW34S2,usd,2025-09-21T06:04:50.626838192Z,us,stocks,Axcelis Technologies Inc,XNAS,BBG001SF8W86,ACLS,CS
True,0001786205,BBG00QHJM4S9,usd,2025-09-21T06:04:50.626838273Z,us,stocks,"Arcellx, Inc. Common Stock",XNAS,BBG00QHJM4W4,ACLX,CS
True,0000868857,BBG000F61RJ8,usd,2025-09-21T06:04:50.626838353Z,us,stocks,Aecom,XNYS,BBG001SKTTF1,ACM,CS
True,0001680062,BBG00HPSG933,usd,2025-09-21T06:04:50.626838433Z,us,stocks,"ACM Research, Inc. Class A Common Stock",XNAS,BBG00HPSG942,ACMR,CS
True,0001467373,,usd,2025-09-21T06:04:50.626838513Z,us,stocks,Accenture PLC,XNYS,,ACN,CS
True,0000715579,BBG000BJ2LY9,usd,2025-09-21T06:04:50.626838593Z,us,stocks,ACNB Corp,XNAS,BBG001S6CVZ3,ACNB,CS
True,0000095953,BBG000CLRHW7,usd,2025-09-21T06:04:50.626838713Z,us,stocks,Ascent Industries Co. Common Stock,XNAS,BBG001S6Z1R3,ACNT,CS
True,0001655923,BBG011CJPRD0,usd,2025-09-21T06:04:50.626838794Z,us,stocks,Alpha Cognition Inc. Common Stock,XNAS,BBG00L7TXNM1,ACOG,CS
True,0001635077,BBG014FBN4K3,usd,2025-09-21T06:04:50.626838874Z,us,stocks,"Aclarion, Inc. Common Stock",XNAS,BBG014FBN5N7,ACON,CS
True,0001635077,BBG016Z2HS66,usd,2025-09-21T06:04:50.626838964Z,us,stocks,"Aclarion, Inc. Warrant",XNAS,,ACONW,WARRANT
True,0001503290,BBG0017VSC04,usd,2025-09-21T06:04:50.626839044Z,us,stocks,abrdn Income Credit Strategies Fund,XNYS,BBG001TCSLH4,ACP,FUND
True,0001503290,,usd,2025-09-21T06:04:50.626839124Z,us,stocks,abrdn Income Credit Strategies Fund  5.250% Series A Perpetual Preferred Stock,XNYS,,ACPpA,PFD
True,0001332551,BBG000HK4RX6,usd,2025-09-21T06:04:50.626839204Z,us,stocks,ACRES Commercial Realty Corp.,XNYS,BBG001SP6Y91,ACR,CS
True,0001529377,BBG0022MMQB0,usd,2025-09-21T06:04:50.626839285Z,us,stocks,Ares Commercial Real Estate Corporation,XNYS,BBG0022MMR46,ACRE,CS
True,0001557746,BBG003LF0QR9,usd,2025-09-21T06:04:50.626839365Z,us,stocks,"Aclaris Therapeutics, Inc.",XNAS,BBG003LF0QS8,ACRS,CS
True,0001781174,BBG011RWR2Q4,usd,2025-09-21T06:04:50.626839445Z,us,stocks,"Acrivon Therapeutics, Inc. Common Stock",XNAS,BBG011RWR2R3,ACRV,CS
True,0001332551,,usd,2025-09-21T06:04:50.626839525Z,us,stocks,"ACRES Commercial Realty Corp. 8.625% Fixed-to-Floating Series C Cumulative Redeemable Preferred Stock, par value $0.001 per share",XNYS,,ACRpC,PFD
True,0001332551,,usd,2025-09-21T06:04:50.626839605Z,us,stocks,ACRES Commercial Realty Corp. 7.875% Series D Cumulative Redeemable Preferred Stock,XNYS,,ACRpD,PFD
True,0001387131,BBG00F40VFY6,usd,2025-09-21T06:04:50.626839685Z,us,stocks,American Customer Satisfaction ETF,BATS,BBG00F40VGP4,ACSI,ETF
True,0001823529,BBG00WSNP4R3,usd,2025-09-21T06:04:50.626839765Z,us,stocks,"Enact Holdings, Inc. Common Stock",XNAS,BBG00WSNP4S2,ACT,CS
True,0000934549,BBG000KF9J02,usd,2025-09-21T06:04:50.626839846Z,us,stocks,Acacia Research Corporation,XNAS,BBG001SJLJT9,ACTG,CS
True,0001652935,BBG00NK7LK03,usd,2025-09-21T06:04:50.626839926Z,us,stocks,"Actuate Therapeutics, Inc. Common stock",XNAS,BBG00NK7LK12,ACTU,CS
True,0001552947,BBG00Y002P42,usd,2025-09-21T06:04:50.626840026Z,us,stocks,LeaderShares Activist Leaders ETF,ARCX,BBG00Y002QG7,ACTV,ETF
True,0000002098,BBG000BB3LM8,usd,2025-09-21T06:04:50.626840106Z,us,stocks,Acme United Corporation,XASE,BBG001S5NCC0,ACU,CS
True,0001636289,BBG008HMBD22,usd,2025-09-21T06:04:50.626840186Z,us,stocks,Virtus Diversified Income & Convertible Fund,XNYS,BBG008HMBD31,ACV,FUND
True,0001637873,BBG00G5JGQ66,usd,2025-09-21T06:04:50.626840266Z,us,stocks,ACV Auctions Inc.,XNYS,BBG00G5JGQ75,ACVA,CS
True,,BBG00Y04Q9T7,usd,2025-09-21T06:04:50.626840347Z,us,stocks,American Conservative Values ETF,ARCX,BBG00Y04QBN8,ACVF,ETF
True,,BBG01TQ0YGP6,usd,2025-09-21T06:04:50.626840457Z,us,stocks,Advent Convertible Bond ETF,ARCX,BBG01TQ0YHK9,ACVT,ETF
True,0001100663,BBG000TH6VB3,usd,2025-09-21T06:04:50.626840537Z,us,stocks,iShares MSCI ACWI ETF,XNAS,BBG001S56QV7,ACWI,ETF
True,0001100663,BBG0025X38X0,usd,2025-09-21T06:04:50.626840617Z,us,stocks,iShares MSCI Global Min Vol Factor ETF,BATS,BBG0025X39Q6,ACWV,ETF
True,0001100663,BBG000TH7DF8,usd,2025-09-21T06:04:50.626840697Z,us,stocks,iShares MSCI ACWI ex US ETF,XNAS,BBG001S56R18,ACWX,ETF
True,0001736243,BBG01184DNJ4,usd,2025-09-21T06:04:50.626840777Z,us,stocks,"Acurx Pharmaceuticals, Inc. Common Stock",XNAS,BBG01184DNK2,ACXP,CS
True,0000821130,BBG000BW6P59,usd,2025-09-21T06:04:50.626840858Z,us,stocks,"Array Digital Infrastructure, Inc.",XNYS,BBG001S5X446,AD,CS
True,0001818838,BBG00YZ6BYJ6,usd,2025-09-21T06:04:50.626840938Z,us,stocks,Adagene Inc. American Depositary Shares,XNAS,BBG00YZ6BZC0,ADAG,ADRC
True,0001273685,BBG000GZ8014,usd,2025-09-21T06:04:50.626841018Z,us,stocks,"Adamas Trust, Inc. Common Stock",XNAS,BBG001SHHBR7,ADAM,CS
True,0001273685,,usd,2025-09-21T06:04:50.626841348Z,us,stocks,"Adamas Trust, Inc. 9.125% Senior Notes Due 2030",XNAS,,ADAMG,CS
True,0001273685,,usd,2025-09-21T06:04:50.626841429Z,us,stocks,"Adamas Trust, Inc. 9.875% Senior Notes Due 2030",XNAS,,ADAMH,CS
True,0001273685,,usd,2025-09-21T06:04:50.626841509Z,us,stocks,"Adamas Trust, Inc. 9.125% Senior Notes Due 2029",XNAS,,ADAMI,CS
True,0001273685,,usd,2025-09-21T06:04:50.626841589Z,us,stocks,"Adamas Trust, Inc. 6.875% Series F Fixed-to-Floating Rate Cumulative Redeemable Preferred Stock, $0.01 par value per share",XNAS,,ADAML,CS
True,0001273685,,usd,2025-09-21T06:04:50.626841669Z,us,stocks,"Adamas Trust, Inc. 7.875% Series E Fixed-to-Floating Rate Cumulative Redeemable Preferred Stock",XNAS,,ADAMM,PFD
True,0001273685,,usd,2025-09-21T06:04:50.626841749Z,us,stocks,"Adamas Trust, Inc. 8.00% Series D Fixed-to-Floating Rate Cumulative Redeemable Preferred Stock",XNAS,,ADAMN,PFD
True,0001273685,,usd,2025-09-21T06:04:50.626841829Z,us,stocks,"Adamas Trust, Inc. 7.000% Series G Cumulative Redeemable Preferred Stock, $0.01 par value per share",XNAS,,ADAMZ,CS
True,0001621227,BBG008G65WC2,usd,2025-09-21T06:04:50.62684191Z,us,stocks,Adaptimmune Therapeutics plc American Depositary Shares,XNAS,BBG008G65WD1,ADAP,ADRC
True,0000796343,BBG000BB5006,usd,2025-09-21T06:04:50.62684199Z,us,stocks,Adobe Inc.,XNAS,BBG001S5NCQ5,ADBE,CS
True,0001976322,BBG01SWP6HM8,usd,2025-09-21T06:04:50.62684206Z,us,stocks,Leverage Shares 2X Long ADBE Daily ETF,XNAS,BBG01SWP6JH0,ADBG,ETF
True,0000917251,BBG000BC9DK0,usd,2025-09-21T06:04:50.62684215Z,us,stocks,Agree Realty Corporation,XNYS,BBG001S6RY81,ADC,CS
True,0001771910,,usd,2025-09-21T06:04:50.62684223Z,us,stocks,ADC Therapeutics SA,XNYS,,ADCT,CS
True,0000917251,,usd,2025-09-21T06:04:50.62684231Z,us,stocks,"Agree Realty Corporation Depositary Shares, each representing 1/1,000th of a 4.250% Series A Cumulative Redeemable Preferred Stock",XNYS,,ADCpA,PFD
True,0001803696,BBG00RBFBL50,usd,2025-09-21T06:04:50.62684239Z,us,stocks,Adeia Inc. Common Stock,XNAS,BBG00RBFBL78,ADEA,CS
True,0001552947,BBG00WRFGTJ5,usd,2025-09-21T06:04:50.626842471Z,us,stocks,Anfield Dynamic Fixed Income ETF,BATS,BBG00WRFGV91,ADFI,ETF
True,0002006986,BBG01P202S42,usd,2025-09-21T06:04:50.626842551Z,us,stocks,"Adagio Medical Holdings, Inc Common Stock",XNAS,BBG01P202S60,ADGM,CS
True,0000006281,BBG000BB6G37,usd,2025-09-21T06:04:50.626842631Z,us,stocks,"Analog Devices, Inc.",XNAS,BBG001S5ND38,ADI,CS
True,0001513525,BBG00HNGDTR4,usd,2025-09-21T06:04:50.626842711Z,us,stocks,"Adial Pharmaceuticals, Inc",XNAS,BBG00HNGDTS3,ADIL,CS
True,,BBG00ZV17TH6,usd,2025-09-21T06:04:50.626842791Z,us,stocks,SmartETFs Asia Pacific Dividend Builder ETF,ARCX,BBG00ZV17VD5,ADIV,ETF
True,0000007084,BBG000BB6WG8,usd,2025-09-21T06:04:50.626842901Z,us,stocks,Archer Daniels Midland Company,XNYS,BBG001S5ND74,ADM,CS
True,0001368514,BBG002NCK5M5,usd,2025-09-21T06:04:50.626842982Z,us,stocks,"ADMA Biologics, Inc.",XNAS,BBG002NCK5N4,ADMA,CS
True,0001539639,BBG00D20HG22,usd,2025-09-21T06:04:50.626843062Z,us,stocks,Aptus Behavioral Momentum ETF,BATS,BBG00D20HG31,ADME,ETF
True,0001744494,BBG00MDV8X34,usd,2025-09-21T06:04:50.626843142Z,us,stocks,"Advent Technologies Holdings, Inc. Class A Common Stock",XNAS,BBG00MDV8XV3,ADN,CS
True,0001670541,,usd,2025-09-21T06:04:50.626843222Z,us,stocks,Adient plc Ordinary Shares,XNYS,,ADNT,CS
True,0001744494,BBG00MVVPD93,usd,2025-09-21T06:04:50.626843302Z,us,stocks,"Advent Technologies Holdings, Inc. Warrant",XNAS,,ADNWW,WARRANT
True,0000008670,BBG000JG0547,usd,2025-09-21T06:04:50.626843382Z,us,stocks,Automatic Data Processing,XNAS,BBG001S82KF6,ADP,CS
True,0001478320,BBG001J2PFF5,usd,2025-09-21T06:04:50.626843463Z,us,stocks,Adaptive Biotechnologies Corporation Common Stock,XNAS,BBG001V0GG18,ADPT,CS
True,,BBG01BBJQ2C4,usd,2025-09-21T06:04:50.626843553Z,us,stocks,Adaptiv Select ETF,ARCX,BBG01BBJQ3B3,ADPV,ETF
True,0001879248,,usd,2025-09-21T06:04:50.626843633Z,us,stocks,ADS-TEC ENERGY PLC Ordinary Shares,XNAS,,ADSE,CS
True,0001879248,,usd,2025-09-21T06:04:50.626843713Z,us,stocks,ADS-TEC ENERGY PLC Warrant,XNAS,,ADSEW,WARRANT
True,0000769397,BBG000BM7HL0,usd,2025-09-21T06:04:50.626843793Z,us,stocks,Autodesk Inc,XNAS,BBG001S5SCD4,ADSK,CS
True,0001703056,BBG000BP9WJ1,usd,2025-09-21T06:04:50.626843873Z,us,stocks,ADT Inc.,XNYS,BBG001S6VGG6,ADT,CS
True,0000926282,BBG0169CH7X9,usd,2025-09-21T06:04:50.626843953Z,us,stocks,"ADTRAN Holdings, Inc. Common Stock",XNAS,BBG0169CH7Y8,ADTN,CS
True,0001726711,BBG00RDV1WS5,usd,2025-09-21T06:04:50.626844044Z,us,stocks,"Aditxt, Inc. Common Stock",XNAS,BBG00RDV1WT4,ADTX,CS
True,0001863934,BBG011F62496,usd,2025-09-21T06:04:50.626844124Z,us,stocks,Aduro Clean Technologies Inc. Common Stock,XNAS,BBG00N9ZZX01,ADUR,CS
True,0001468328,BBG000NJGX84,usd,2025-09-21T06:04:50.626844334Z,us,stocks,Addus HomeCare Corp.,XNAS,BBG001T56D18,ADUS,CS
True,0001776661,BBG00PPWZ8C7,usd,2025-09-21T06:04:50.626844414Z,us,stocks,Advantage Solutions Inc. Class A Common Stock,XNAS,BBG00PPWZ8G3,ADV,CS
True,0001941029,BBG01HW4B3M4,usd,2025-09-21T06:04:50.626844565Z,us,stocks,Advanced Biomed Inc. Common Stock,XNAS,BBG01HW4B3N3,ADVB,CS
True,,BBG01JFHH825,usd,2025-09-21T06:04:50.626844645Z,us,stocks,Matthews Asia Dividend Active ETF,ARCX,BBG01JFHH923,ADVE,ETF
True,0001501756,BBG006D9MR17,usd,2025-09-21T06:04:50.626844725Z,us,stocks,"Adverum Biotechnologies, Inc. Common Stock",XNAS,BBG006D9MR26,ADVM,CS
True,0001776661,BBG00Q6CTMG2,usd,2025-09-21T06:04:50.626844805Z,us,stocks,Advantage Solutions Inc. Warrant,XNAS,,ADVWW,WARRANT
True,0000002230,BBG000BB8MR6,usd,2025-09-21T06:04:50.626844885Z,us,stocks,"Adams Diversified Equity Fund, Inc",XNYS,BBG001S5NDV7,ADX,FUND
True,0001574232,BBG00R48ST95,usd,2025-09-21T06:04:50.626844965Z,us,stocks,Addex Therapeutics Ltd American Depositary Shares,XNAS,BBG00R48SV18,ADXN,ADRC
True,0002048519,,usd,2025-09-21T06:04:50.626845056Z,us,stocks,Aebi Schmidt Holding AG Common Stock,XNAS,,AEBI,CS
True,0001519469,BBG002PL1DW6,usd,2025-09-21T06:04:50.626845126Z,us,stocks,Anfield Energy Inc. Common Shares,XNAS,BBG001V114Z2,AEC,CS
